<big class="word">Mozambique</big>	<small class="ipa">ˌməʊzamˈbiːk</small>	PHOTO: AGENCE FRANCE-PRESSE Published 1 hour ago BEIRA (<b>Mozambique</b>) • Rescue workers extended their search in <b>Mozambique</b> yesterday for survivors of devastating floods following a powerful cyclone that ripped through southern Africa a week ago, killing hundreds and destroying buildings and farmland. 	A country on the east coast of southern Africa; population 28,000,000 (estimated 2015); languages, Portuguese (official), Bantu languages; capital, Maputo.
<big class="word">contra</big>	<small class="ipa">ˈkɒntrə</small>	Now Duo exploited <b>contra</b> trading for nefarious ends, says prosecution Published 1 hour ago Accused, lover allegedly tapped personal and business ties to control trading accounts Malaysian businessman John Soh Chee Wen and girlfriend Quah Su-Ling tapped family members, friends, associates and companies related to them, and "exploited <b>contra</b> trading to serve their nefarious ends", prosecutors yesterday outlined on the first day of the trial of Singapore's most serious case of stock market manipulation. 	A member of a guerrilla force in Nicaragua which opposed the left-wing Sandinista government 1979–90, and was supported by the US for much of that time.
<big class="word">magnate</big>	<small class="ipa">ˈmaɡneɪt</small>	Thaksin, a former policeman who became a billionaire telecommunications <b>magnate</b>, became premier in 2001 when he won at the polls. 	A wealthy and influential businessman or businesswoman.
<big class="word">indicted</big>	<small class="ipa">ɪnˈdʌɪt</small>	NO MORE INDICTMENTS Mr Trump's former national security adviser Mike Flynn, his former personal lawyer Michael Cohen and his campaign chairman Paul Manafort are among the 34 individuals already <b>indicted</b> by Mr Mueller, but they will be the last, according to Mr Barr. 	Formally accuse of or charge with a crime.
<big class="word">harrowing</big>	<small class="ipa">ˈharəʊɪŋ</small>	WASHINGTON POST Stricken cruise ship docks after <b>harrowing</b> rescue at sea Viking Sky cruise ship arrives, after problems the ship got in the storm outside of Hustadvika, at Molde, Norway, on March 24, 2019. 	Acutely distressing.
<big class="word">Edinburgh</big>	<small class="ipa">ˈɛdɪnbərə</small>	Flight bound for Dusseldorf flown to <b>Edinburgh</b> by mistake Published 1 hour ago LONDON • Passengers aboard a British Airways flight from London to Dusseldorf yesterday got a surprise when their plane landed in <b>Edinburgh</b> instead of the German city. 	The capital of Scotland, on the southern shore of the Firth of Forth; population 449,100 (est. 2009). The city grew up round the 11th-century castle built by Malcolm III on a rocky ridge that dominates the landscape.
<big class="word">al fresco</big>	<small class="ipa">Error: Page not found</small>	Long wait at Johor Customs leads to <b>al fresco</b> dinner A posting on Facebook showing tourists eating packed food during a long wait to clear Customs at the Sultan Abu Bakar Complex in Johor.PHOTO: IVY CHEE/ FACEBOOK Published 1 hour ago JOHOR BARU • A netizen said to be a tour guide has posted on	Error: Page not found
<big class="word">Hamas</big>	<small class="ipa">haˈmas</small>	REUTERS Netanyahu cuts short US trip on rising Gaza tensions Israeli police examining a house in Moshav Mishmeret, north of Tel Aviv, yesterday that was hit by a rocket that the military said was launched by <b>Hamas</b> from about 120km away. 	A Palestinian Islamic movement founded in 1987 with the aim of establishing a Palestinian state incorporating present-day Israel and the West Bank. In 2006 Hamas defeated the more moderate Fatah in the elections for the Palestinian National Authority.
<big class="word">Penal</big>	<small class="ipa">ˈpiːn(ə)l</small>	Both men are assisting the police with investigations, for the offence of communicating an electronic record to incite violence under Section 267C of the <b>Penal</b> Code. 	Relating to, used for, or prescribing the punishment of offenders under the legal system.
<big class="word">tsar</big>	<small class="ipa">zɑː</small>	Subscribe Now China jails ex-Internet <b>tsar</b> 14 years for corruption Former chief Internet regulator Lu Wei pleaded guilty in October, after prosecutors accused him of abusing his power in various government posts over 15 years.PHOTO: REUTERS Published 1 hour ago Former chief Web regulator	An emperor of Russia before 1917.
<big class="word">vie</big>	<small class="ipa">vʌɪ</small>	It took 15 years for sea bass developed at the Marine Aquaculture Centre on St John's Island to reach farms for mass production last year. 3 projects <b>vie</b> for $20m funding in healthcare research challenge Published 2 hours ago Three projects using artificial intelligence technologies were unveiled yesterday to battle it out in a healthcare research challenge that promises funding of up to $20 million for the winner. 	Compete eagerly with someone in order to do or achieve something.
<big class="word">logjam</big>	<small class="ipa">ˈlɒɡdʒam</small>	AGENCE FRANCE-PRESSE How no-deal exit will hit Britain Published 2 hours ago LONDON • If Britain fails to break its Brexit <b>logjam</b>, the country is faced with the prospect of crashing out of the European Union on April 12. 	A crowded mass of logs blocking a river.
<big class="word">perennial</big>	<small class="ipa">pəˈrɛnɪəl</small>	Researchers suggest the cluster, which represents the "<b>perennial</b> segment of less religious people in society", may encourage contestations over issues pertinent to religion and the law. 	Lasting or existing for a long or apparently infinite time; enduring or continually recurring.
<big class="word">nigh</big>	<small class="ipa">nʌɪ</small>	PHOTO: AGENCE FRANCE-PRESSE Published 1 hour ago Country will bid farewell to Heisei era when Emperor Akihito abdicates on April 30 The end of an era is <b>nigh</b> for Japan, which will bid farewell to the Heisei ("achieving peace") period when its revered Emperor Akihito steps down on April 30 and usher in a new epoch as the clock strikes mid<b>nigh</b>t on May 1. 	Near.
<big class="word">ordinance</big>	<small class="ipa">ˈɔːdɪnəns</small>	A Cabinet meeting will follow to approve an <b>ordinance</b> for the new name. 	An authoritative order.
<big class="word">junta</big>	<small class="ipa">ˈdʒʌntə</small>	Both the Palang Pracharath Party - which seeks to keep <b>junta</b> leader Prayut Chan-o-cha in office - and an anti-<b>junta</b> "democratic front" of seven parties, led by Pheu Thai, have claimed a mandate to form the next government. 	A military or political group that rules a country after taking power by force.
<big class="word">err</big>	<small class="ipa">əː</small>	ShanmugamPHOTO: GOV.SG Published 1 hour ago Minister outlines Republic's approach to preserving racial harmony and tackling hate speech Singapore is prepared to <b>err</b> on the side of caution to preserve racial harmony, said Law and Home Affairs Minister K. 	Be mistaken or incorrect; make a mistake.
<big class="word">indemnity</big>	<small class="ipa">ɪnˈdɛmnɪti</small>	Hadi Health Ministry to spell out doctors' obligations clearly HEALTH MINISTER GAN KIM YONG Published 1 hour ago This follows concern in medical profession over recent SMC rulings and CGH negligence case Singapore does not want to go the way of the United States, where a "significant fraction of healthcare costs goes towards medical <b>indemnity</b> insurance", said Health Minister Gan Kim Yong. 	Security or protection against a loss or other financial burden.
<big class="word">Midas</big>	<small class="ipa">ˈmʌɪdəs</small>	<b>Midas</b> faces liquidation after failing to find rescuer Published 1 hour ago Insolvent <b>Midas</b> Holdings is facing liquidation after it failed to lock in a rescue deal from Hong Kong-listed CRRC Corp. 	A king of Phrygia, who, according to one story, was given by Dionysus the power of turning everything he touched into gold.
<big class="word">apogee</big>	<small class="ipa">ˈapədʒiː</small>	But 24 of the pieces "are going above the <b>apogee</b> of the International Space Station", added Mr Bridenstine. 	The highest point in the development of something; a climax or culmination.
<big class="word">serendipitously</big>	<small class="ipa"></small>	Mr Lim had almost jumped off a block in 2011 but changed his mind when a friend <b>serendipitously</b> texted him - without knowing he was sitting on the ledge of the 21st floor - asking him out for coffee. 	Error: Definition not found
<big class="word">proselytising</big>	<small class="ipa">ˈprɒsɪlɪtʌɪz</small>	RAYMOND KOH, 64 Aug 2011: State religious authority investigates Mr Koh's non-profit organisation Harapan Komuniti for <b>proselytising</b> to Muslims after it hosted a thanksgiving dinner. 	Convert or attempt to convert (someone) from one religion, belief, or opinion to another.
<big class="word">harried</big>	<small class="ipa">ˈharɪd</small>	AGENCE FRANCE-PRESSE Ardern pays for groceries of mum who forgot purse Published 1 hour ago WELLINGTON • New Zealand Prime Minister Jacinda Ardern has confirmed that she paid for a <b>harried</b> mother's groceries, a gesture sure to enhance a reputation already soaring because of her response to the Christchurch mosque attacks. 	Feeling strained as a result of having demands persistently made on one; harassed.
<big class="word">belched</big>	<small class="ipa">bɛltʃ</small>	Winston <b>belched</b> again. 	Emit wind noisily from the stomach through the mouth.
<big class="word">zealot</big>	<small class="ipa">ˈzɛlət</small>	Some nosing <b>zealot</b> in the Ministry (a woman, probably: someone like the little sandy-haired woman or the dark-haired girl from the Fiction Department) might start wondering why he had been writing during the lunch interval, why he had used an old-fashioned pen, what he had been writing – and then drop a hint in the appropriate quarter. 	A person who is fanatical and uncompromising in pursuit of their religious, political, or other ideals.
<big class="word">perpetuating</big>	<small class="ipa">pəˈpɛtʃʊeɪt</small>	More or less consciously, he found an analogy between British Labour and the Communist Party under Stalin – both, he felt, were movements professing to fight for the working classes against capitalism but in reality concerned only with establishing and <b>perpetuating</b> their own power. 	Make (something) continue indefinitely.
<big class="word">disposition</big>	<small class="ipa">dɪspəˈzɪʃ(ə)n</small>	Now, those of fascistic <b>disposition</b> – or merely those among us who remain all too ready to justify any government action, whether right or wrong – will immediately point out that this is pre-war thinking, and that the moment enemy bombs begin to fall on one’s homeland, altering the landscape and producing casualties among friends and neighbours, all this sort of thing, really, becomes irrelevant, if not indeed subversive. 	A person's inherent qualities of mind and character.
<big class="word">fascism</big>	<small class="ipa">ˈfaʃɪz(ə)m</small>	With the homeland in danger, strong leadership and effective measures become of the essence, and if you want to call that <b>fascism</b>, very well, call it whatever you please, no one is likely to be listening, unless it’s for the air raids to be over and the all clear to sound. 	An authoritarian and nationalistic right-wing system of government and social organization.
<big class="word">unseemliness</big>	<small class="ipa">ʌnˈsiːmlɪnəs</small>	But the <b>unseemliness</b> of an argument – let alone a prophecy – in the heat of some later emergency, does not necessarily make it wrong. 	Error: Definition not found
<big class="word">incontrovertibly</big>	<small class="ipa">ˌɪnkɒntrəˈvəːtɪbli</small>	What in Keir Hardie’s time had been an honourable struggle against the <b>incontrovertibly</b> criminal behaviour of capitalism towards those whom it used for profit had become, by Orwell’s time, shamefully institutional, bought and sold, in too many instances concerned only with maintaining itself in power. 	Error: Definition not found
<big class="word">capitalism</big>	<small class="ipa">ˈkapɪt(ə)lɪz(ə)m</small>	What in Keir Hardie’s time had been an honourable struggle against the incontrovertibly criminal behaviour of <b>capitalism</b> towards those whom it used for profit had become, by Orwell’s time, shamefully institutional, bought and sold, in too many instances concerned only with maintaining itself in power. 	An economic and political system in which a country's trade and industry are controlled by private owners for profit, rather than by the state.
<big class="word">gulags</big>	<small class="ipa">ˈɡuːlaɡ</small>	And that was just in England – abroad, the impulse had been further corrupted, in immeasurably more sinister ways, leading at length to the Stalinist <b>gulags</b> and the Nazi death camps. 	A system of labour camps maintained in the Soviet Union from 1930 to 1955 in which many people died.
<big class="word">socialist</big>	<small class="ipa">ˈsəʊʃ(ə)lɪst</small>	Orwell’s critique of England’s official Left was to undergo some modification in July 1945, when, at the first opportunity they got, the British electorate, by a landslide, threw out their wartime rulers and put in a Labour government, which would remain in power till 1951 – beyond what would be left of Orwell’s lifetime – during which period Labour finally got its chance to reshape British society along ‘<b>socialist</b>’ lines. 	A person who advocates or practises socialism.
<big class="word">consummate</big>	<small class="ipa">ˈkɒns(j)əmeɪt</small>	The <b>consummate</b> embodiment of doublethink in this novel is the Inner Party official O’Brien, Winston’s seducer and betrayer, protector and destroyer. 	Make (a marriage or relationship) complete by having sexual intercourse.
<big class="word">self-contradicting</big>	<small class="ipa">ˌsɛlfkɒntrəˈdɪktɪŋ</small>	He imagines himself a mere cell of the greater organism of the State, but it is his individuality, compelling and <b>self-contradicting</b>, that we remember. 	Characterized by inconsistency between aspects or parts of a whole.
<big class="word">eloquent</big>	<small class="ipa">ˈɛləkwənt</small>	Although a calmly <b>eloquent</b> spokesman for the totalitarian future, O’Brien gradually reveals an unbalanced side, a disengagement from reality that will emerge in its full unpleasantness during the re-education of Winston Smith, in the place of pain and despair known as the Ministry of Love. 	Fluent or persuasive in speaking or writing.
<big class="word">inestimable</big>	<small class="ipa">ɪnˈɛstɪməb(ə)l</small>	Needless to say, this is of <b>inestimable</b> use to those in power who wish to remain there, preferably forever. 	Too great to calculate.
<big class="word">subtext</big>	<small class="ipa">ˈsʌbtɛkst</small>	Orwell’s uneasiness over the ‘peace’ in fact is one major <b>subtext</b> of Nineteen Eighty-Four. 	An underlying and often distinct theme in a piece of writing or conversation.
<big class="word">pronouncement</big>	<small class="ipa">prəˈnaʊnsm(ə)nt</small>	‘Who rules the Heartland commands the World-Island,’ as Mackinder had put it, and ‘Who rules the World-Island commands the world,’ a <b>pronouncement</b> not lost on Hitler and other theoreticians of realpolitik. 	A formal or authoritative announcement or declaration.
<big class="word">realpolitik</big>	<small class="ipa">reɪˈɑːlpɒlɪˌtiːk</small>	‘Who rules the Heartland commands the World-Island,’ as Mackinder had put it, and ‘Who rules the World-Island commands the world,’ a pronouncement not lost on Hitler and other theoreticians of <b>realpolitik</b>. 	A system of politics or principles based on practical rather than moral or ideological considerations.
<big class="word">transmogrifying</big>	<small class="ipa">tranzˈmɒɡrɪfʌɪ</small>	By this point Orwell, who took Burnham seriously but not uncritically, may have sensed that the man’s thinking was sort of on the flighty side – nevertheless traces of Burnham’s geopolitics can be found in the tripartite world balance of power of Nineteen Eight-Four, with Burnham’s victorious Japan becoming Eastasia, Russia, the pivotal heartland, controlling the Eurasian landmass, and the Anglo-American Alliance <b>transmogrifying</b> to Oceania, which is the setting for Nineteen Eighty-Four. 	Transform in a surprising or magical manner.
<big class="word">subservience</big>	<small class="ipa">səbˈsəːvɪəns</small>	This grouping of Britain and the United States into a single bloc, as prophecy, has turned out to be dead-on, foreseeing Britain’s resistance to integration with the Eurasian landmass as well as her continuing <b>subservience</b> to Yank interests – dollars, for instance, being the monetary unit of Oceania. 	Willingness to obey others unquestioningly.
<big class="word">dystopian</big>	<small class="ipa">dɪsˈtəʊpɪən</small>	From the opening, with its cold plunge directly into the grim April day of Winston Smith’s decisive, act of disobedience, the textures of <b>dystopian</b> life are unremitting – the uncooperative plumbing, the cigarettes that keep losing their tobacco, the horrible food – though perhaps this was not such an imaginative stretch for anyone who’d had to undergo wartime shortages. 	Relating to or denoting an imagined state or society where there is great suffering or injustice.
<big class="word">unremitting</big>	<small class="ipa">ʌnrɪˈmɪtɪŋ</small>	From the opening, with its cold plunge directly into the grim April day of Winston Smith’s decisive, act of disobedience, the textures of dystopian life are <b>unremitting</b> – the uncooperative plumbing, the cigarettes that keep losing their tobacco, the horrible food – though perhaps this was not such an imaginative stretch for anyone who’d had to undergo wartime shortages. 	Never relaxing or slackening; incessant.
<big class="word">insidiously</big>	<small class="ipa">ɪnˈsɪdɪəsli</small>	What has steadily, <b>insidiously</b>, improved since then, of course, making humanist arguments almost irrelevant, is the technology. 	In a gradual, subtle way, but with harmful effects.
<big class="word">quaint</big>	<small class="ipa">kweɪnt</small>	In ‘our’ 1984, after all, the integrated circuit chip was less than a decade old, and almost embarrassingly primitive next to the wonders of computer technology circa 2003, most notably the Internet, a development that promises social control on a scale those <b>quaint</b> old twentieth-century tyrants with their goofy moustaches could only dream about. 	Attractively unusual or old-fashioned.
<big class="word">expository</big>	<small class="ipa">ɪksˈpɒzɪtri</small>	And he remains an offstage presence whose real function in Nineteen Eighty-Four is to provide an <b>expository</b> voice, as the author of The Theory and Practice of Oligarchical Collectivism. 	Intended to explain or describe something.
<big class="word">anti-Semitic</big>	<small class="ipa">ˌantɪsɪˈmɪtɪk</small>	Much has been made recently of Orwell’s own attitude toward Jews, some commentators even going so far as to call it <b>anti-Semitic</b>. 	Hostile to or prejudiced against Jews.
<big class="word">overt</big>	<small class="ipa">əʊˈvəːt</small>	If one looks in his writing of the time for <b>overt</b> references to the topic, one finds relatively little – Jewish matters did not seem to command much of his attention. 	Done or shown openly; plainly apparent.
<big class="word">reticence</big>	<small class="ipa">ˈrɛtɪs(ə)ns</small>	There is some felt <b>reticence</b>, as if, with so many other deep issues to worry about, Orwell would have preferred that the world not be presented the added inconvenience of having to think much about the Holocaust. 	The quality of being reticent; reserve.
<big class="word">nationalism</big>	<small class="ipa">ˈnaʃ(ə)n(ə)lɪz(ə)m</small>	‘Nor is there any racial discrimination,’ as Emmanuel Goldstein himself confirms, in the book – ‘Jews, Negroes, South Americans of pure Indian blood are to be found in the highest ranks of the Party …’ As nearly as one can tell, Orwell considered anti-Semitism ‘one variant of the great modern disease of <b>nationalism</b>’, and British anti-Semitism in particular as another form of British stupidity. 	Identification with one's own nation and support for its interests, especially to the exclusion or detriment of the interests of other nations.
<big class="word">bourgeois</big>	<small class="ipa">ˈbʊəʒwɑː</small>	His own artistic judgements were not those of Winston Smith, a <b>bourgeois</b> of the late forties projected into the future. 	Belonging to or characteristic of the middle class, typically with reference to its perceived materialistic values or conventional attitudes.
<big class="word">apologist</big>	<small class="ipa">əˈpɒlədʒɪst</small>	But somewhere among his own terrors may have lurked the possibility that like Galsworthy he might one day lose his political anger, and end up as one more <b>apologist</b> for Things As They Are. 	A person who offers an argument in defence of something controversial.
<big class="word">slaloms</big>	<small class="ipa">ˈslɑːləm</small>	PHOTO: AGENCE FRANCE-PRESSE Published 1 hour ago SHANGHAI • Ms Chen Jiuxiao puts on virtual reality goggles and is immediately transported to a snow-covered ski slope, down which she <b>slaloms</b> without ever leaving Shanghai. 	A ski race down a winding course marked out by poles.
<big class="word">neonatal</big>	<small class="ipa">ˌniːə(ʊ)ˈneɪt(ə)l</small>	Over the past five years, it has hit a <b>neonatal</b> unit in Venezuela, swept through a hospital in Spain, forced a prestigious British medical centre to shut down its intensive care unit, and taken root in India, Pakistan and South Africa. 	Relating to newborn children (or other mammals)
<big class="word">tenacious</big>	<small class="ipa">tɪˈneɪʃəs</small>	C. auris is so <b>tenacious</b>, in part, because it is impervious to major anti-fungal medications. 	Tending to keep a firm hold of something; clinging or adhering closely.
<big class="word">impervious</big>	<small class="ipa">ɪmˈpəːvɪəs</small>	C. auris is so tenacious, in part, because it is <b>impervious</b> to major anti-fungal medications. 	Not allowing fluid to pass through.
<big class="word">vernacular</big>	<small class="ipa">vəˈnakjʊlə</small>	What was ‘disgusting rubbish’ back in a more insulated time has become, by the post-war era, part of the <b>vernacular</b> of political education, and by 1984 in Oceania it will be institutionalized. 	The language or dialect spoken by the ordinary people in a particular country or region.
<big class="word">debase</big>	<small class="ipa">dɪˈbeɪs</small>	It has become a commonplace circa 2003 for government employees to be paid more than most of the rest of us to <b>debase</b> history, trivialize truth and annihilate the past on a daily basis. 	Reduce (something) in quality or value; degrade.
<big class="word">anterooms</big>	<small class="ipa">ˈantɪruːm</small>	By the time they have left the Ministry of Love, Winston and Julia have entered permanently the condition of doublethink, the <b>anterooms</b> of annihilation, no longer in love but able to hate and love Big Brother at the same time. 	An antechamber, typically serving as a waiting room.
<big class="word">dystopia</big>	<small class="ipa">dɪsˈtəʊpɪə</small>	In its hints of restoration and redemption, perhaps ‘The Principles of Newspeak’ serves as a way to brighten an otherwise bleakly pessimistic ending – sending us back out into the streets of our own <b>dystopia</b> whistling a slightly happier tune than the end of the story by itself would have warranted. 	An imagined state or society in which there is great suffering or injustice, typically one that is totalitarian or post-apocalyptic.
<big class="word">contrived</big>	<small class="ipa">kənˈtrʌɪvd</small>	It was one of those pictures which are so <b>contrived</b> that the eyes follow you about when you move. 	Deliberately created rather than arising naturally or spontaneously.
<big class="word">bluebottle</big>	<small class="ipa">ˈbluːbɒt(ə)l</small>	In the far distance a helicopter skimmed down between the roofs, hovered for an instant like a <b>bluebottle</b>, and darted away again with a curving flight. 	A common blowfly with a metallic-blue body, the female of which often comes into houses searching for a suitable food source on which to lay her eggs.
<big class="word">grimy</big>	<small class="ipa">ˈɡrʌɪmi</small>	A kilometre away the Ministry of Truth, his place of work, towered vast and white above the <b>grimy</b> landscape. 	Covered with or characterized by grime.
<big class="word">corrugated</big>	<small class="ipa">ˈkɒrəɡeɪtɪd</small>	Were there always these vistas of rotting nineteenth-century houses, their sides shored up with baulks of timber, their windows patched with cardboard and their roofs with <b>corrugated</b> iron, their crazy garden walls sagging in all directions? 	(of a material or surface) shaped into a series of parallel ridges and grooves so as to give added rigidity and strength.
<big class="word">tour de force</big>	<small class="ipa">Error: Page not found</small>	The leading articles in the Times were written in it but this was a <b>tour de force</b> which could only be carried out by a specialist. 	Error: Page not found
