<big class="word">stowaway</big>	<small class="ipa">ˈstəʊəweɪ</small>	REUTERS Suspected <b>stowaway</b> falls to death from plane LONDON • The body of a suspected <b>stowaway</b> fell hundreds of metres from a plane flying over south-west London, landing in the garden of a man's home, just missing him as he sunbathed, neighbours said. 	A person who stows away on a passenger vehicle.
<big class="word">tantalising</big>	<small class="ipa">ˈtantəlʌɪz</small>	Limits to what can be gained from China-bound investment The US-China trade war is turning into a big economic headache amid shrinking exports and as Chinese consumers dial back spending.PHOTO: AFP Published 1 hour ago Neighbours unable to muscle in as firms there are unlikely to exit It was supposed to represent a <b>tantalising</b> opportunity for the region's economies to muscle in on foreign investment bound for China. 	Torment or tease (someone) with the sight or promise of something that is unobtainable.
<big class="word">awnings</big>	<small class="ipa">ˈɔːnɪŋ</small>	Condo <b>awnings</b> a reasonable response to killer litter: Board The owners of two units at D'Leedon, a condominium complex in the prime Tanglin district, had sought permission last year to install <b>awnings</b> at their ground-floor units, in response to a killer litter problem.ST PHOTO: DESMOND FOO Published 1 hour ago Strata Titles Board takes issue with D'Leedon MC for initial refusal of unit owners' request The Strata Titles Board has taken issue with the management corporation (MC) of D'Leedon after the MC initially refused to allow the owners	A sheet of canvas or other material stretched on a frame and used to keep the sun or rain off a shop window, doorway, or ship's deck.
<big class="word">anathema</big>	<small class="ipa">əˈnaθəmə</small>	5 Inside the Uighur camps Western media reports vilify Uighur re-education centres as concentration camps, but it is hard to fault China for wanting to rehabilitate the Uighurs if their ideology is <b>anathema</b> to the Chinese state and hostile to other communities, says associate editor Ravi Velloor after a visit to these centres. 	Something or someone that one vehemently dislikes.
<big class="word">jockey</big>	<small class="ipa">ˈdʒɒki</small>	Court orders US$620,900 to be returned to ex-<b>jockey</b> Former <b>jockey</b> Saimee Jumaat had invested in a forex trading service in 2012, on the advice of two financial advisers. 	A person who rides in horse races, especially as a profession.
<big class="word">seamstress</big>	<small class="ipa">ˈsiːmstrəs</small>	Many protesters, like <b>seamstress</b> Celia Cheung, 66, said they attended the march yesterday because they felt it was important to lend support to a movement that seems to be losing momentum: "We need to keep pressing on until the government responds." 	A woman who sews, especially one who earns her living by sewing.
<big class="word">described</big>	<small class="ipa">dɪˈskrʌɪb</small>	In others, the newspaper said the envoy had <b>described</b> the administration as "uniquely dysfunctional" and that media reports about White House "knife fights" are "mostly true". 	Give a detailed account in words of.
<big class="word">dysfunctional</big>	<small class="ipa">dɪsˈfʌŋkʃənl</small>	In others, the newspaper said the envoy had described the administration as "uniquely <b>dysfunctional</b>" and that media reports about White House "knife fights" are "mostly true". 	Not operating normally or properly.
<big class="word">unvarnished</big>	<small class="ipa">ʌnˈvɑːnɪʃt</small>	The Mail on Sunday cited a spokesman as saying that the public would expect diplomats "to provide ministers with an honest, <b>unvarnished</b> assessment of the politics in their countries". 	Not covered with varnish.
<big class="word">brouhaha</big>	<small class="ipa">ˈbruːhɑːhɑː</small>	REUTERS Brazil's President repeatedly defends child labour Published 1 hour ago RIO DE JANEIRO • Brazilian President Jair Bolsonaro, no stranger to controversy, sparked a new <b>brouhaha</b> last week by repeatedly defending the practice of child labour. 	A noisy and overexcited reaction or response to something.
<big class="word">demagoguery</big>	<small class="ipa">dɛməˈɡɒɡ(ə)ri</small>	This is not <b>demagoguery</b>, it is the truth." 	Political activity or practices that seek support by appealing to the desires and prejudices of ordinary people rather than by using rational argument.
<big class="word">crux</big>	<small class="ipa">krʌks</small>	The <b>crux</b> of Japan's position is that South Korea has, since 2004, benefited from favourable trade measures as a "trusted" country, and the "restrictions" are in effect a return to the norm. 	The decisive or most important point at issue.
<big class="word">consorting</big>	<small class="ipa">ˈkɒnsɔːt</small>	Tan Hong Sheng, 22, Loo Boon Chong, 25, and Chan Jia Xing, 26, had their charges reclassified to <b>consorting</b> with a person carrying an offensive weapon in a public place. 	A wife, husband, or companion, in particular the spouse of a reigning monarch.
<big class="word">But</big>	<small class="ipa">bʌt</small>	<b>But</b> none of the women showed any sign of being cowed by the President. 	Used to introduce a phrase or clause contrasting with what has already been mentioned.
<big class="word">cowed</big>	<small class="ipa">kaʊ</small>	But none of the women showed any sign of being <b>cowed</b> by the President. 	A fully grown female animal of a domesticated breed of ox, kept to produce milk or beef.
<big class="word">surreptitiously</big>	<small class="ipa">ˌsʌrəpˈtɪʃəsli</small>	Rei Kurohi Prudential sues ex-agency leader for up to $2.5b over mass exodus of agents Prudential accuses former agency leader Peter Tan Shou Yi of "<b>surreptitiously</b>" orchestrating the mass defection of agents in 2016. 	In a way that attempts to avoid notice or attention; secretively.
<big class="word">phalanx</big>	<small class="ipa">ˈfalaŋks</small>	Sometimes a <b>phalanx</b> of bodyguards jogs beside them. 	A body of troops or police officers standing or moving in close formation.
<big class="word">cachet</big>	<small class="ipa">ˈkaʃeɪ</small>	Singapore Airlines has always had the global <b>cachet</b> to merit a second hub, and the partnership with India's Vistara may well give it that opportunity, says associate editor Ravi Velloor. 	The state of being respected or admired; prestige.
<big class="word">fluke</big>	<small class="ipa">fluːk</small>	girl dies after dad's golf ball strikes her head Aria Hill was sitting in a golf cart at the course where her father was teeing off when the accident happened.PHOTO: GOFUNDME/ ARIA HILL MEMORIAL FUND Published 1 hour ago SALT LAKE CITY (Utah) • A six-year-old girl in Utah died on Monday after she was struck in the head by a golf ball hit by her father, in what her uncle described as a "<b>fluke</b> accident". 	An unlikely chance occurrence, especially a surprising piece of luck.
<big class="word">subjugation</big>	<small class="ipa">sʌbdʒʊˈɡeɪʃ(ə)n</small>	The <b>subjugation</b> of one race by another, the domination of women throughout thousands of years of patriarchy, and the devaluing of people based on social class are for growing numbers of us nightmares of the past. 	The action of bringing someone or something under domination or control.
<big class="word">EVOCATION</big>	<small class="ipa">ɛvəˈkeɪʃ(ə)n</small>	That is the arising of the new earth. —Eckhart Tolle October 2015 CHAPTER ONE The Flowering of Human Consciousness <b>EVOCATION</b> Earth, 114 million years ago, one morning just after sunrise: The first flower ever to appear on the planet opens up to receive the rays of the sun. 	The act of bringing or recalling a feeling, memory, or image to the conscious mind.
<big class="word">ethereal</big>	<small class="ipa">ɪˈθɪərɪəl</small>	Flowers, more fleeting, more <b>ethereal</b>, and more delicate than the plants out of which they emerged, would become like messengers from another realm, like a bridge between the world of physical forms and the formless. 	Extremely delicate and light in a way that seems not to be of this world.
<big class="word">immemorial</big>	<small class="ipa">ɪmɪˈmɔːrɪəl</small>	Since time <b>immemorial</b>, flowers, crystals, precious stones, and birds have held special significance for the human spirit. 	Originating in the distant past; very old.
<big class="word">recognition</big>	<small class="ipa">rɛkəɡˈnɪʃ(ə)n</small>	An essential part of the awakening is the <b>recognition</b> of the unawakened you, the ego as it thinks, speaks, and acts, as well as the <b>recognition</b> of the collectively conditioned mental processes that perpetuate the unawakened state. 	Identification of someone or something or person from previous encounters or knowledge.
<big class="word">perpetuate</big>	<small class="ipa">pəˈpɛtʃʊeɪt</small>	An essential part of the awakening is the recognition of the unawakened you, the ego as it thinks, speaks, and acts, as well as the recognition of the collectively conditioned mental processes that <b>perpetuate</b> the unawakened state. 	Make (something) continue indefinitely.
<big class="word">sages</big>	<small class="ipa">seɪdʒ</small>	Ramana Maharshi, one of the greatest Indian <b>sages</b>, bluntly states: “The mind is maya.” 	An aromatic plant whose greyish-green leaves are used as a culinary herb, native to southern Europe and the Mediterranean.
<big class="word">maimed</big>	<small class="ipa">meɪm</small>	When the war was over in 1918, the survivors looked in horror and incomprehension upon the devastation left behind: ten million human beings killed and many more <b>maimed</b> or disfigured. 	Wound or injure (a person or animal) so that part of the body is permanently damaged.
<big class="word">contemporaries</big>	<small class="ipa">kənˈtɛmp(ə)r(ər)i</small>	Those rare individuals then spoke to their <b>contemporaries</b>. 	Living or occurring at the same time.
<big class="word">iconoclastic</big>	<small class="ipa">ˌʌɪkɒnəˈklastɪk</small>	Most of these schools were <b>iconoclastic</b>. 	Criticizing or attacking cherished beliefs or institutions.
<big class="word">dogma</big>	<small class="ipa">ˈdɒɡmə</small>	Partly as a result of the spiritual teachings that have arisen outside the established religions, but also due to an influx of the ancient Eastern wisdom teachings, a growing number of followers of traditional religions are able to let go of identification with form, <b>dogma</b>, and rigid belief systems and discover the original depth that is hidden within their own spiritual tradition at the same time as they discover the depth within themselves. 	A principle or set of principles laid down by an authority as incontrovertibly true.
<big class="word">ossified</big>	<small class="ipa">ˈɒsɪfʌɪ</small>	But the ego is destined to dissolve, and all its <b>ossified</b> structures, whether they be religious or other institutions, corporations, or governments, will disintegrate from within, no matter how deeply entrenched they appear to be. 	Turn into bone or bony tissue.
<big class="word">impervious</big>	<small class="ipa">ɪmˈpəːvɪəs</small>	The most rigid structures, the most <b>impervious</b> to change, will collapse first. 	Not allowing fluid to pass through.
<big class="word">insurmountable</big>	<small class="ipa">ˌɪnsəˈmaʊntəb(ə)l</small>	THE URGENCY OF TRANSFORMATION When faced with a radical crisis, when the old way of being in the world, of interacting with each other and with the realm of nature doesn’t work anymore, when survival is threatened by seemingly <b>insurmountable</b> problems, an individual life-form—or a species—will either die or become extinct or rise above the limitations of its condition through an evolutionary leap. 	Too great to be overcome.
<big class="word">incessant</big>	<small class="ipa">ɪnˈsɛs(ə)nt</small>	Most people are still completely identified with the <b>incessant</b> stream of mind, of compulsive thinking, most of it repetitive and pointless. 	(of something regarded as unpleasant) continuing without pause or interruption.
<big class="word">bulimia</big>	<small class="ipa">bjʊˈlɪmɪə</small>	The sufferers of <b>bulimia</b> will often make themselves vomit so they can continue eating. 	An emotional disorder characterized by a distorted body image and an obsessive desire to lose weight, in which bouts of extreme overeating are followed by fasting or self-induced vomiting or purging.
<big class="word">sleuth</big>	<small class="ipa">sluːθ</small>	Concert in the Gardens Music, the food of love Unravelling the Dark Web: Hacks into hitman sites led to arrest of Singaporean ST ILLUSTRATION: MANNY FRANCISCO Published 1 hour ago Murder plot uncovered by London-based cyber <b>sleuth</b> who exposed Dark Web scams They exist in the shadowy online world to cater to clients' vengeful desires. 	A detective.
<big class="word">psyche</big>	<small class="ipa">ˈsʌɪki</small>	Collective grievances can survive for centuries in the <b>psyche</b> of a nation or tribe and fuel a never-ending cycle of violence. 	The human soul, mind, or spirit.
<big class="word">Marxist</big>	<small class="ipa">ˈmɑːksɪst</small>	To him, the <b>Marxist</b> interpretation of history was the absolute truth, and according to his version of it, those who wore glasses belonged to the educated class, the bourgeoisie, the exploiters of the peasants. 	A supporter of the political and economic theories of Karl Marx and Friedrich Engels.
<big class="word">bourgeoisie</big>	<small class="ipa">ˌbʊəʒwɑːˈziː</small>	To him, the Marxist interpretation of history was the absolute truth, and according to his version of it, those who wore glasses belonged to the educated class, the <b>bourgeoisie</b>, the exploiters of the peasants. 	The middle class, typically with reference to its perceived materialistic values or conventional attitudes.
<big class="word">Homeopathy</big>	<small class="ipa">ˌhəʊmɪˈɒpəθi</small>	<b>Homeopathy</b> and Chinese medicine are two examples of possible alternative approaches to disease that do not treat the illness as an enemy and therefore do not create new diseases. 	A system of complementary medicine in which ailments are treated by minute doses of natural substances that in larger amounts would produce symptoms of the ailment.
<big class="word">conformist</big>	<small class="ipa">kənˈfɔːmɪst</small>	Whereas in the 1950s, most Americans were still extremely <b>conformist</b> in thought and behavior, in the 1960s, millions of people began to withdraw their identification with a collective conceptual identity because the insanity of the collective was so obvious. 	A person who conforms to accepted behaviour or established practices.
<big class="word">officiate</big>	<small class="ipa">əˈfɪʃɪeɪt</small>	THE MONK WITH SWEATY PALMS Kasan, a Zen teacher and monk, was to <b>officiate</b> at a funeral of a famous nobleman. 	Act as an official in charge of something, especially a sporting event.
<big class="word">elusive</big>	<small class="ipa">ɪˈluːsɪv</small>	Happiness is ever <b>elusive</b>, but freedom from unhappiness is attainable now, by facing what is rather than making up stories about it. 	Difficult to find, catch, or achieve.
<big class="word">premier</big>	<small class="ipa">ˈprɛmɪə</small>	PHOTO: REUTERS Published 1 hour ago Leader known for declaring martial law prior to Tiananmen crackdown in 1989 Former Chinese <b>premier</b> Li Peng, who declared martial law on national television days before the 1989 Tiananmen crackdown, died just before midnight on Monday of unspecified illness, state media announced yesterday. 	First in importance, order, or position; leading.
<big class="word">great</big>	<small class="ipa">ɡreɪt</small>	In his keynote address, he said Hong Kong still has a "<b>great</b> future" because it is useful to China. 	Of an extent, amount, or intensity considerably above average.
<big class="word">proviso</big>	<small class="ipa">prəˈvʌɪzəʊ</small>	But with the <b>proviso</b> that neither Hong Kong nor Macau tries to change mainland China, he added. 	A condition or qualification attached to an agreement or statement.
<big class="word">prophylactically</big>	<small class="ipa">ˌprɒfɪˈlaktɪkli</small>	Taking this <b>prophylactically</b>, it can prevent you from getting infected," said Dr Mike Robertson, director of global clinical development for virology at MSD research. 	Error: Definition not found
<big class="word">angioplasty</big>	<small class="ipa">ˈandʒɪə(ʊ)ˌplasti</small>	ESM Goh back in office after undergoing <b>angioplasty</b> Emeritus Senior Minister Goh Chok Tong said in a Facebook post he was back in the office after undergoing an <b>angioplasty</b> procedure on Tuesday, and apologised for having to cancel some events.PHOTO: ST FILE Published 1 hour ago Emeritus Senior Minister Goh Chok Tong on Tuesday underwent an <b>angioplasty</b> to restore blood flow in his arteries. 	Surgical repair or unblocking of a blood vessel, especially a coronary artery.
<big class="word">prostatic</big>	<small class="ipa">prɒˈstatɪk</small>	Published 1 hour ago CNB officers not told of <b>prostatic</b> massages because of 'uncertainty' over gay sex law: Ler The doctor involved in the HIV registry data leak told a court yesterday that he was "afraid of being penalised" under Section 377A of the Penal Code for providing <b>prostatic</b> massages, and decided against telling narcotics officers about it. 	Error: Definition not found
<big class="word">edifice</big>	<small class="ipa">ˈɛdɪfɪs</small>	Most of what they tell you about themselves, their story, is a complete fantasy, a fictitious <b>edifice</b> the ego has designed for itself to feel bigger, more special. 	A large, imposing building.
<big class="word">McCarthyism</big>	<small class="ipa">məˈkɑːθɪɪz(ə)m</small>	The Spanish Inquisition, the persecution and burning of heretics and “witches,” the relations between nations leading up to the First and Second World Wars, Communism throughout its history, the “Cold War,” <b>McCarthyism</b> in America in the 1950s, prolonged violent conflict in the Middle East are all painful episodes in human history dominated by extreme collective paranoia. 	A vociferous campaign against alleged communists in the US government and other institutions carried out under Senator Joseph McCarthy in the period 1950–4. Many of the accused were blacklisted or lost their jobs, though most did not in fact belong to the Communist Party.
<big class="word">aggrandizement</big>	<small class="ipa">əˈɡrandɪzmənt</small>	In some cases the personal ego seems to dissolve completely as someone dedicates his or her life to working selflessly for the greater good of the collective without demanding personal rewards, recognition, or <b>aggrandizement</b>. 	Error: Definition not found
<big class="word">volition</big>	<small class="ipa">vəˈlɪʃ(ə)n</small>	The statement “I think” implies <b>volition</b>. 	The faculty or power of using one's will.
<big class="word">emanate</big>	<small class="ipa">ˈɛməneɪt</small>	They do, indeed, but we need to differentiate between positive emotions that are ego-generated and deeper emotions that <b>emanate</b> from your natural state of connectedness with Being. 	(of a feeling, quality, or sensation) issue or spread out from (a source)
<big class="word">pilfer</big>	<small class="ipa">ˈpɪlfə</small>	PHOTO: POLSEK SUKAWATI/ FACEBOOK Published 1 hour ago A video of a family from India trying to <b>pilfer</b> items from a Bali hotel has gone viral, with several netizens lamenting that their action could cast a negative light on other Indian tourists travelling to the Indonesian resort island. 	Steal (things of little value)
<big class="word">midges</big>	<small class="ipa">mɪdʒ</small>	ST PHOTO: ARIFFIN JAMAR Published 2 hours ago 1 Midges at Pandan Reservoir Swarms of <b>midges</b> are back to plague residents, as an increase of these small insects can be seen around Housing Board blocks near Pandan Reservoir. 	A small or minute two-winged fly that forms swarms and breeds near water or marshy areas.
<big class="word">The</big>	<small class="ipa">ðə</small>	<b>The</b> three-minute video was posted on the Hong Kong garrison's official Weibo social media account late on Wednesday. 	Denoting one or more people or things already mentioned or assumed to be common knowledge.
<big class="word">garrison</big>	<small class="ipa">ˈɡarɪs(ə)n</small>	The three-minute video was posted on the Hong Kong <b>garrison</b>'s official Weibo social media account late on Wednesday. 	A group of troops stationed in a fortress or town to defend it.
<big class="word">gallows</big>	<small class="ipa">ˈɡaləʊz</small>	Kovan Road murders: Ex-cop fails in bid to escape the <b>gallows</b> Published 2 hours ago His clemency petition to President over 2013 killings of businessman and son is denied A former policeman who was sentenced to death in 2015 for a crime that came to be known as the Kovan double murder has failed in his clemency petition to the President. 	A structure, typically of two uprights and a crosspiece, for the hanging of criminals.
<big class="word">emanation</big>	<small class="ipa">ɛməˈneɪʃ(ə)n</small>	Other babies may cry frequently because they can sense the <b>emanation</b> of their mother’s and father’s negative emotion, and it causes them pain and also causes their pain-body to grow already by absorbing energy from the parents’ pain-bodies. 	Something which originates or issues from a source.
<big class="word">vicariously</big>	<small class="ipa">vɪˈkɛːrɪəsli</small>	So, in addition to reactivity, negative thinking, and personal drama, the pain-body also renews itself <b>vicariously</b> through the cinema and television screen. 	In a way that is experienced in the imagination through the actions of another person.
<big class="word">revered</big>	<small class="ipa">rɪˈvɪə</small>	But then why in many ancient pre-Christian civilizations such as the Sumerian, Egyptian, and Celtic were women respected and the feminine principle not feared but <b>revered</b>? 	Feel deep respect or admiration for (something)
<big class="word">Not</big>	<small class="ipa">nɒt</small>	<b>Not</b> surprisingly, it is strong as well in Native Americans, whose numbers were decimated and whose culture all but destroyed by the European settlers. 	Error: Definition not found
<big class="word">decimated</big>	<small class="ipa">ˈdɛsɪmeɪt</small>	Not surprisingly, it is strong as well in Native Americans, whose numbers were <b>decimated</b> and whose culture all but destroyed by the European settlers. 	Kill, destroy, or remove a large proportion of.
<big class="word">incarcerated</big>	<small class="ipa">ɪnˈkɑːsəreɪt</small>	Brazil's <b>incarcerated</b> population has surged eightfold in three decades to around 750,000 inmates. 	Imprison or confine.
<big class="word">chastised</big>	<small class="ipa">tʃaˈstʌɪz</small>	President Joko Widodo, on his visit to PLN's headquarters on Monday, <b>chastised</b> the company for the incident, urging it to fix the problem as soon as possible. 	Rebuke or reprimand severely.
<big class="word">antiquities</big>	<small class="ipa">anˈtɪkwɪti</small>	He said looted <b>antiquities</b> from Iraq may be another source of revenue for ISIS, also known as ISIL, and returnees from the conflict said there was a special unit responsible for selling such objects. 	The ancient past, especially the period of classical and other human civilizations before the Middle Ages.
<big class="word">encroaching</big>	<small class="ipa">ɪnˈkrəʊtʃ</small>	However, many Hong Kong residents feel that Beijing has been increasingly <b>encroaching</b> on their freedoms. 	Intrude on (a person's territory, rights, personal life, etc.)
<big class="word">Kashmir</big>	<small class="ipa">kaʃˈmɪə</small>	The country's Hindu nationalist-led government has used a presidential order to revoke the special constitutional status of Muslim-majority <b>Kashmir</b>, a move criticised by Pakistan.PHOTO: ASSOCIATED PRESS Security personnel at a roadblock in Jammu yesterday. 	A region on the northern border of India and north-eastern Pakistan. Formerly a state of India, it has been disputed between India and Pakistan since partition in 1947, with sporadic outbreaks of fighting. The north-western part is controlled by Pakistan, most of it forming the state of Azad Kashmir, while the remainder is incorporated into the Indian state of Jammu and Kashmir.
<big class="word">varsity</big>	<small class="ipa">ˈvɑːsɪti</small>	KYODO US <b>varsity</b> sued over Malaysian PhD student's suicide Ms Jerusha Sanjeevi had enrolled as a doctoral student in Utah State University just eight months before her suicide. 	University.
<big class="word">injunction</big>	<small class="ipa">ɪnˈdʒʌŋ(k)ʃ(ə)n</small>	They may not have realized either that, no matter how great a revelation or how accurate the information they received, it would ultimately prove to be of no avail, would not save them from further unhappiness and self-created suffering, if they failed to find the truth that is concealed in that <b>injunction</b>—Know Thyself. 	An authoritative warning or order.
<big class="word">succulent</big>	<small class="ipa">ˈsʌkjʊl(ə)nt</small>	The warmth of the sun on your skin, the display of magnificent flowers outside a florist’s shop, biting into a <b>succulent</b> fruit, or getting soaked in an abundance of water falling from the sky. 	(of food) tender, juicy, and tasty.
