id	word_key	book_key	dict_key	pos	usage	timestamp
The_Straits_Times:C51C5486:132289:13	en:Mozambique	The_Straits_Times:C51C5486	B0053VMNYW	132289	PHOTO: AGENCE FRANCE-PRESSE Published 1 hour ago BEIRA (Mozambique) • Rescue workers extended their search in Mozambique yesterday for survivors of devastating floods following a powerful cyclone that ripped through southern Africa a week ago, killing hundreds and destroying buildings and farmland. 	1553471513506
The_Straits_Times:23A71D10:16334:9	en:contra	The_Straits_Times:23A71D10	B0053VMNYW	16334	"Now Duo exploited contra trading for nefarious ends, says prosecution Published 1 hour ago Accused, lover allegedly tapped personal and business ties to control trading accounts Malaysian businessman John Soh Chee Wen and girlfriend Quah Su-Ling tapped family members, friends, associates and companies related to them, and ""exploited contra trading to serve their nefarious ends"", prosecutors yesterday outlined on the first day of the trial of Singapore's most serious case of stock market manipulation. "	1553555949691
The_Straits_Times:23A71D10:49605:10	en:magnate	The_Straits_Times:23A71D10	B0053VMNYW	49605	Thaksin, a former policeman who became a billionaire telecommunications magnate, became premier in 2001 when he won at the polls. 	1553556194871
The_Straits_Times:23A71D10:70266:11	en:indicted	The_Straits_Times:23A71D10	B0053VMNYW	70266	NO MORE INDICTMENTS Mr Trump's former national security adviser Mike Flynn, his former personal lawyer Michael Cohen and his campaign chairman Paul Manafort are among the 34 individuals already indicted by Mr Mueller, but they will be the last, according to Mr Barr. 	1553556465406
The_Straits_Times:23A71D10:83855:12	en:harrowing	The_Straits_Times:23A71D10	B0053VMNYW	83855	WASHINGTON POST Stricken cruise ship docks after harrowing rescue at sea Viking Sky cruise ship arrives, after problems the ship got in the storm outside of Hustadvika, at Molde, Norway, on March 24, 2019. 	1553593834246
The_Straits_Times:23A71D10:106789:12	en:Edinburgh	The_Straits_Times:23A71D10	B0053VMNYW	106789	Flight bound for Dusseldorf flown to Edinburgh by mistake Published 1 hour ago LONDON • Passengers aboard a British Airways flight from London to Dusseldorf yesterday got a surprise when their plane landed in Edinburgh instead of the German city. 	1553593877610
The_Straits_Times:23A71D10:122198:12	en:al fresco	The_Straits_Times:23A71D10	B0053VMNYW	122198	Long wait at Johor Customs leads to al fresco dinner A posting on Facebook showing tourists eating packed food during a long wait to clear Customs at the Sultan Abu Bakar Complex in Johor.PHOTO: IVY CHEE/ FACEBOOK Published 1 hour ago JOHOR BARU • A netizen said to be a tour guide has posted on	1553594152618
The_Straits_Times:23A71D10:135753:8	en:Hamas	The_Straits_Times:23A71D10	B0053VMNYW	135753	REUTERS Netanyahu cuts short US trip on rising Gaza tensions Israeli police examining a house in Moshav Mishmeret, north of Tel Aviv, yesterday that was hit by a rocket that the military said was launched by Hamas from about 120km away. 	1553594404127
The_Straits_Times:23A71D10:167001:8	en:Penal	The_Straits_Times:23A71D10	B0053VMNYW	167001	Both men are assisting the police with investigations, for the offence of communicating an electronic record to incite violence under Section 267C of the Penal Code. 	1553595444015
The_Straits_Times:23A71D10:217530:10	en:en bloc	The_Straits_Times:23A71D10	B0053VMNYW	217530	ness of the location, which is sea-facing and has an MRT station coming up nearby, and the spaciousness of the units.ST FILE PHOTO Published 1 hour ago Despite record $2.927b asking price, only 68% of the units signed agreement, below the 80% needed Mandarin Gardens, a sprawling leasehold condominium in Siglap, has failed in its attempt to sell en bloc, despite a record-high asking price of $2.927 billion. 	1553596751034
The_Straits_Times:57111DD7:69310:7	en:tsar	The_Straits_Times:57111DD7	B0053VMNYW	69310	Subscribe Now China jails ex-Internet tsar 14 years for corruption Former chief Internet regulator Lu Wei pleaded guilty in October, after prosecutors accused him of abusing his power in various government posts over 15 years.PHOTO: REUTERS Published 1 hour ago Former chief Web regulator	1553643762826
The_Straits_Times:776B9AB7:44299:6	en:vie	The_Straits_Times:776B9AB7	B0053VMNYW	44299	It took 15 years for sea bass developed at the Marine Aquaculture Centre on St John's Island to reach farms for mass production last year. 3 projects vie for $20m funding in healthcare research challenge Published 2 hours ago Three projects using artificial intelligence technologies were unveiled yesterday to battle it out in a healthcare research challenge that promises funding of up to $20 million for the winner. 	1553730755122
The_Straits_Times:776B9AB7:148875:9	en:logjam	The_Straits_Times:776B9AB7	B0053VMNYW	148875	AGENCE FRANCE-PRESSE How no-deal exit will hit Britain Published 2 hours ago LONDON • If Britain fails to break its Brexit logjam, the country is faced with the prospect of crashing out of the European Union on April 12. 	1553730885823
The_Straits_Times:F8C2176B:30692:13	en:ambivalent	The_Straits_Times:F8C2176B	B0053VMNYW	30692	They desire some separation between religion and politics, and are ambivalent towards those of other faiths. 	1553816327960
The_Straits_Times:F8C2176B:31082:12	en:perennial	The_Straits_Times:F8C2176B	B0053VMNYW	31082	"Researchers suggest the cluster, which represents the ""perennial segment of less religious people in society"", may encourage contestations over issues pertinent to religion and the law. "	1553816368978
The_Straits_Times:F8C2176B:94952:8	en:moots	The_Straits_Times:F8C2176B	B0053VMNYW	94952	REUTERS Taiwan moots death penalty for drink drivers Published 1 hour ago Rights groups protest over plan to execute those who kill while driving intoxicated TAIPEI • Taiwan plans to ramp up punishments for those who cause a fatal accident while drink driving, including the death penalty for the most egregious cases, sparking an outcry from abolition	1553816560935
The_Straits_Times:5E399786:53299:7	en:nigh	The_Straits_Times:5E399786	B0053VMNYW	53299	"PHOTO: AGENCE FRANCE-PRESSE Published 1 hour ago Country will bid farewell to Heisei era when Emperor Akihito abdicates on April 30 The end of an era is nigh for Japan, which will bid farewell to the Heisei (""achieving peace"") period when its revered Emperor Akihito steps down on April 30 and usher in a new epoch as the clock strikes midnight on May 1. "	1554074953552
The_Straits_Times:5E399786:54760:12	en:ordinance	The_Straits_Times:5E399786	B0053VMNYW	54760	A Cabinet meeting will follow to approve an ordinance for the new name. 	1554074988410
The_Straits_Times:5E399786:80962:8	en:junta	The_Straits_Times:5E399786	B0053VMNYW	80962	"Both the Palang Pracharath Party - which seeks to keep junta leader Prayut Chan-o-cha in office - and an anti-junta ""democratic front"" of seven parties, led by Pheu Thai, have claimed a mandate to form the next government. "	1554075047072
The_Straits_Times:295CA9ED:63549:6	en:err	The_Straits_Times:295CA9ED	B0053VMNYW	63549	ShanmugamPHOTO: GOV.SG Published 1 hour ago Minister outlines Republic's approach to preserving racial harmony and tackling hate speech Singapore is prepared to err on the side of caution to preserve racial harmony, said Law and Home Affairs Minister K. 	1554162093518
The_Straits_Times:295CA9ED:242021:14	en:significant	The_Straits_Times:295CA9ED	B0053VMNYW	242021	"Hadi Health Ministry to spell out doctors' obligations clearly HEALTH MINISTER GAN KIM YONG Published 1 hour ago This follows concern in medical profession over recent SMC rulings and CGH negligence case Singapore does not want to go the way of the United States, where a ""significant fraction of healthcare costs goes towards medical indemnity insurance"", said Health Minister Gan Kim Yong. "	1554247950589
The_Straits_Times:295CA9ED:242084:12	en:indemnity	The_Straits_Times:295CA9ED	B0053VMNYW	242084	"Hadi Health Ministry to spell out doctors' obligations clearly HEALTH MINISTER GAN KIM YONG Published 1 hour ago This follows concern in medical profession over recent SMC rulings and CGH negligence case Singapore does not want to go the way of the United States, where a ""significant fraction of healthcare costs goes towards medical indemnity insurance"", said Health Minister Gan Kim Yong. "	1554247957677
The_Straits_Times:295CA9ED:297970:8	en:Midas	The_Straits_Times:295CA9ED	B0053VMNYW	297970	Midas faces liquidation after failing to find rescuer Published 1 hour ago Insolvent Midas Holdings is facing liquidation after it failed to lock in a rescue deal from Hong Kong-listed CRRC Corp. 	1554248385855
The_Straits_Times:93F6441D:116336:9	en:apogee	The_Straits_Times:93F6441D	B0053VMNYW	116336	"But 24 of the pieces ""are going above the apogee of the International Space Station"", added Mr Bridenstine. "	1554286516658
The_Straits_Times:93F6441D:199415:18	en:serendipitously	The_Straits_Times:93F6441D	B0053VMNYW	199415	Mr Lim had almost jumped off a block in 2011 but changed his mind when a friend serendipitously texted him - without knowing he was sitting on the ledge of the 21st floor - asking him out for coffee. 	1554287019324
The_Straits_Times:41F1E8A6:115352:16	en:proselytising	The_Straits_Times:41F1E8A6	B0053VMNYW	115352	RAYMOND KOH, 64 Aug 2011: State religious authority investigates Mr Koh's non-profit organisation Harapan Komuniti for proselytising to Muslims after it hosted a thanksgiving dinner. 	1554334612380
The_Straits_Times:DE1A8188:133872:10	en:harried	The_Straits_Times:DE1A8188	B0053VMNYW	133872	AGENCE FRANCE-PRESSE Ardern pays for groceries of mum who forgot purse Published 1 hour ago WELLINGTON • New Zealand Prime Minister Jacinda Ardern has confirmed that she paid for a harried mother's groceries, a gesture sure to enhance a reputation already soaring because of her response to the Christchurch mosque attacks. 	1554475152840
Nineteen_Eighty-Four:5EB7488E:112431:10	en:belched	Nineteen_Eighty-Four:5EB7488E	B0053VMNYW	112431	Winston belched again. 	1554642659853
Nineteen_Eighty-Four:5EB7488E:117617:9	en:zealot	Nineteen_Eighty-Four:5EB7488E	B0053VMNYW	117617	Some nosing zealot in the Ministry (a woman, probably: someone like the little sandy-haired woman or the dark-haired girl from the Fiction Department) might start wondering why he had been writing during the lunch interval, why he had used an old-fashioned pen, what he had been writing – and then drop a hint in the appropriate quarter. 	1554642965342
Nineteen_Eighty-Four:5EB7488E:18763:15	en:perpetuating	Nineteen_Eighty-Four:5EB7488E	B0053VMNYW	18763	More or less consciously, he found an analogy between British Labour and the Communist Party under Stalin – both, he felt, were movements professing to fight for the working classes against capitalism but in reality concerned only with establishing and perpetuating their own power. 	1554643515004
Nineteen_Eighty-Four:5EB7488E:19092:14	en:disposition	Nineteen_Eighty-Four:5EB7488E	B0053VMNYW	19092	Now, those of fascistic disposition – or merely those among us who remain all too ready to justify any government action, whether right or wrong – will immediately point out that this is pre-war thinking, and that the moment enemy bombs begin to fall on one’s homeland, altering the landscape and producing casualties among friends and neighbours, all this sort of thing, really, becomes irrelevant, if not indeed subversive. 	1554643547100
Nineteen_Eighty-Four:5EB7488E:19622:10	en:fascism	Nineteen_Eighty-Four:5EB7488E	B0053VMNYW	19622	With the homeland in danger, strong leadership and effective measures become of the essence, and if you want to call that fascism, very well, call it whatever you please, no one is likely to be listening, unless it’s for the air raids to be over and the all clear to sound. 	1554643603646
Nineteen_Eighty-Four:5EB7488E:19784:15	en:unseemliness	Nineteen_Eighty-Four:5EB7488E	B0053VMNYW	19784	But the unseemliness of an argument – let alone a prophecy – in the heat of some later emergency, does not necessarily make it wrong. 	1554643647760
Nineteen_Eighty-Four:5EB7488E:21604:19	en:incontrovertibly	Nineteen_Eighty-Four:5EB7488E	B0053VMNYW	21604	What in Keir Hardie’s time had been an honourable struggle against the incontrovertibly criminal behaviour of capitalism towards those whom it used for profit had become, by Orwell’s time, shamefully institutional, bought and sold, in too many instances concerned only with maintaining itself in power. 	1554643833902
Nineteen_Eighty-Four:5EB7488E:21643:13	en:capitalism	Nineteen_Eighty-Four:5EB7488E	B0053VMNYW	21643	What in Keir Hardie’s time had been an honourable struggle against the incontrovertibly criminal behaviour of capitalism towards those whom it used for profit had become, by Orwell’s time, shamefully institutional, bought and sold, in too many instances concerned only with maintaining itself in power. 	1554643846559
Nineteen_Eighty-Four:5EB7488E:21990:9	en:gulags	Nineteen_Eighty-Four:5EB7488E	B0053VMNYW	21990	And that was just in England – abroad, the impulse had been further corrupted, in immeasurably more sinister ways, leading at length to the Stalinist gulags and the Nazi death camps. 	1554643885017
Nineteen_Eighty-Four:5EB7488E:20634:12	en:socialist	Nineteen_Eighty-Four:5EB7488E	B0053VMNYW	20634	Orwell’s critique of England’s official Left was to undergo some modification in July 1945, when, at the first opportunity they got, the British electorate, by a landslide, threw out their wartime rulers and put in a Labour government, which would remain in power till 1951 – beyond what would be left of Orwell’s lifetime – during which period Labour finally got its chance to reshape British society along ‘socialist’ lines. 	1554643938552
Nineteen_Eighty-Four:5EB7488E:26407:11	en:opposite	Nineteen_Eighty-Four:5EB7488E	B0053VMNYW	26407	Our nominally free news media are required to present ‘balanced’ coverage, in which every ‘truth’ is immediately neutered by an equal and opposite one. 	1554644144658
Nineteen_Eighty-Four:5EB7488E:24815:13	en:consummate	Nineteen_Eighty-Four:5EB7488E	B0053VMNYW	24815	The consummate embodiment of doublethink in this novel is the Inner Party official O’Brien, Winston’s seducer and betrayer, protector and destroyer. 	1554644154962
Nineteen_Eighty-Four:5EB7488E:25221:21	en:self-contradicting	Nineteen_Eighty-Four:5EB7488E	B0053VMNYW	25221	He imagines himself a mere cell of the greater organism of the State, but it is his individuality, compelling and self-contradicting, that we remember. 	1554644210839
Nineteen_Eighty-Four:5EB7488E:25277:11	en:eloquent	Nineteen_Eighty-Four:5EB7488E	B0053VMNYW	25277	Although a calmly eloquent spokesman for the totalitarian future, O’Brien gradually reveals an unbalanced side, a disengagement from reality that will emerge in its full unpleasantness during the re-education of Winston Smith, in the place of pain and despair known as the Ministry of Love. 	1554644215652
Nineteen_Eighty-Four:5EB7488E:26880:14	en:inestimable	Nineteen_Eighty-Four:5EB7488E	B0053VMNYW	26880	Needless to say, this is of inestimable use to those in power who wish to remain there, preferably forever. 	1554644356918
Nineteen_Eighty-Four:5EB7488E:27036:14	en:ambivalence	Nineteen_Eighty-Four:5EB7488E	B0053VMNYW	27036	Besides the ambivalence within the Left as to Soviet realities, other opportunities for doublethink in action arose in the wake of the Second World War. 	1554644370224
Nineteen_Eighty-Four:5EB7488E:27601:10	en:subtext	Nineteen_Eighty-Four:5EB7488E	B0053VMNYW	27601	Orwell’s uneasiness over the ‘peace’ in fact is one major subtext of Nineteen Eighty-Four. 	1554644410483
Nineteen_Eighty-Four:5EB7488E:29508:16	en:pronouncement	Nineteen_Eighty-Four:5EB7488E	B0053VMNYW	29508	‘Who rules the Heartland commands the World-Island,’ as Mackinder had put it, and ‘Who rules the World-Island commands the world,’ a pronouncement not lost on Hitler and other theoreticians of realpolitik. 	1554644556241
Nineteen_Eighty-Four:5EB7488E:29568:14	en:realpolitik	Nineteen_Eighty-Four:5EB7488E	B0053VMNYW	29568	‘Who rules the Heartland commands the World-Island,’ as Mackinder had put it, and ‘Who rules the World-Island commands the world,’ a pronouncement not lost on Hitler and other theoreticians of realpolitik. 	1554644563434
Nineteen_Eighty-Four:5EB7488E:31038:18	en:transmogrifying	Nineteen_Eighty-Four:5EB7488E	B0053VMNYW	31038	By this point Orwell, who took Burnham seriously but not uncritically, may have sensed that the man’s thinking was sort of on the flighty side – nevertheless traces of Burnham’s geopolitics can be found in the tripartite world balance of power of Nineteen Eight-Four, with Burnham’s victorious Japan becoming Eastasia, Russia, the pivotal heartland, controlling the Eurasian landmass, and the Anglo-American Alliance transmogrifying to Oceania, which is the setting for Nineteen Eighty-Four. 	1554644690842
Nineteen_Eighty-Four:5EB7488E:31427:15	en:subservience	Nineteen_Eighty-Four:5EB7488E	B0053VMNYW	31427	This grouping of Britain and the United States into a single bloc, as prophecy, has turned out to be dead-on, foreseeing Britain’s resistance to integration with the Eurasian landmass as well as her continuing subservience to Yank interests – dollars, for instance, being the monetary unit of Oceania. 	1554644732305
Nineteen_Eighty-Four:5EB7488E:31735:12	en:dystopian	Nineteen_Eighty-Four:5EB7488E	B0053VMNYW	31735	From the opening, with its cold plunge directly into the grim April day of Winston Smith’s decisive, act of disobedience, the textures of dystopian life are unremitting – the uncooperative plumbing, the cigarettes that keep losing their tobacco, the horrible food – though perhaps this was not such an imaginative stretch for anyone who’d had to undergo wartime shortages. 	1554644818586
Nineteen_Eighty-Four:5EB7488E:31754:14	en:unremitting	Nineteen_Eighty-Four:5EB7488E	B0053VMNYW	31754	From the opening, with its cold plunge directly into the grim April day of Winston Smith’s decisive, act of disobedience, the textures of dystopian life are unremitting – the uncooperative plumbing, the cigarettes that keep losing their tobacco, the horrible food – though perhaps this was not such an imaginative stretch for anyone who’d had to undergo wartime shortages. 	1554644851143
Nineteen_Eighty-Four:5EB7488E:34091:14	en:insidiously	Nineteen_Eighty-Four:5EB7488E	B0053VMNYW	34091	What has steadily, insidiously, improved since then, of course, making humanist arguments almost irrelevant, is the technology. 	1554645041259
Nineteen_Eighty-Four:5EB7488E:34575:9	en:quaint	Nineteen_Eighty-Four:5EB7488E	B0053VMNYW	34575	In ‘our’ 1984, after all, the integrated circuit chip was less than a decade old, and almost embarrassingly primitive next to the wonders of computer technology circa 2003, most notably the Internet, a development that promises social control on a scale those quaint old twentieth-century tyrants with their goofy moustaches could only dream about. 	1554645131731
Nineteen_Eighty-Four:5EB7488E:35649:13	en:expository	Nineteen_Eighty-Four:5EB7488E	B0053VMNYW	35649	And he remains an offstage presence whose real function in Nineteen Eighty-Four is to provide an expository voice, as the author of The Theory and Practice of Oligarchical Collectivism. 	1554645266007
Nineteen_Eighty-Four:5EB7488E:35958:15	en:anti-Semitic	Nineteen_Eighty-Four:5EB7488E	B0053VMNYW	35958	Much has been made recently of Orwell’s own attitude toward Jews, some commentators even going so far as to call it anti-Semitic. 	1554645283197
Nineteen_Eighty-Four:5EB7488E:36016:8	en:overt	Nineteen_Eighty-Four:5EB7488E	B0053VMNYW	36016	If one looks in his writing of the time for overt references to the topic, one finds relatively little – Jewish matters did not seem to command much of his attention. 	1554645293690
Nineteen_Eighty-Four:5EB7488E:36397:12	en:reticence	Nineteen_Eighty-Four:5EB7488E	B0053VMNYW	36397	There is some felt reticence, as if, with so many other deep issues to worry about, Orwell would have preferred that the world not be presented the added inconvenience of having to think much about the Holocaust. 	1554645329428
Nineteen_Eighty-Four:5EB7488E:37594:14	en:nationalism	Nineteen_Eighty-Four:5EB7488E	B0053VMNYW	37594	‘Nor is there any racial discrimination,’ as Emmanuel Goldstein himself confirms, in the book – ‘Jews, Negroes, South Americans of pure Indian blood are to be found in the highest ranks of the Party …’ As nearly as one can tell, Orwell considered anti-Semitism ‘one variant of the great modern disease of nationalism’, and British anti-Semitism in particular as another form of British stupidity. 	1554645427655
Nineteen_Eighty-Four:5EB7488E:39927:12	en:bourgeois	Nineteen_Eighty-Four:5EB7488E	B0053VMNYW	39927	His own artistic judgements were not those of Winston Smith, a bourgeois of the late forties projected into the future. 	1554645596661
Nineteen_Eighty-Four:5EB7488E:40932:12	en:apologist	Nineteen_Eighty-Four:5EB7488E	B0053VMNYW	40932	But somewhere among his own terrors may have lurked the possibility that like Galsworthy he might one day lose his political anger, and end up as one more apologist for Things As They Are. 	1554645667333
The_Straits_Times:502EA0E2:4673:13	en:exacerbate	The_Straits_Times:502EA0E2	B0053VMNYW	4673	"""The effects of climate change, where the temperature is expected to rise, are going to exacerbate the challenge."" "	1554713811637
The_Straits_Times:502EA0E2:75395:14	en:transported	The_Straits_Times:502EA0E2	B0053VMNYW	75395	PHOTO: AGENCE FRANCE-PRESSE Published 1 hour ago SHANGHAI • Ms Chen Jiuxiao puts on virtual reality goggles and is immediately transported to a snow-covered ski slope, down which she slaloms without ever leaving Shanghai. 	1554714104424
The_Straits_Times:502EA0E2:75451:10	en:slaloms	The_Straits_Times:502EA0E2	B0053VMNYW	75451	PHOTO: AGENCE FRANCE-PRESSE Published 1 hour ago SHANGHAI • Ms Chen Jiuxiao puts on virtual reality goggles and is immediately transported to a snow-covered ski slope, down which she slaloms without ever leaving Shanghai. 	1554714107337
The_Straits_Times:502EA0E2:114126:11	en:pro bono	The_Straits_Times:502EA0E2	B0053VMNYW	114126	imedia content Subscribe Now NUS law students to provide pro bono service to arts sector Published 1 hour ago New elective gives seniors a chance to engage in clinical legal education in the sector Law students from the National University of Singapore (NUS) will soon have more opportunities to put their legal education into practice while serving the community. 	1554714264889
The_Straits_Times:6DA1CC2C:49171:11	en:neonatal	The_Straits_Times:6DA1CC2C	B0053VMNYW	49171	Over the past five years, it has hit a neonatal unit in Venezuela, swept through a hospital in Spain, forced a prestigious British medical centre to shut down its intensive care unit, and taken root in India, Pakistan and South Africa. 	1554766597627
The_Straits_Times:6DA1CC2C:49962:12	en:tenacious	The_Straits_Times:6DA1CC2C	B0053VMNYW	49962	C. auris is so tenacious, in part, because it is impervious to major anti-fungal medications. 	1554766632931
The_Straits_Times:6DA1CC2C:49996:13	en:impervious	The_Straits_Times:6DA1CC2C	B0053VMNYW	49996	C. auris is so tenacious, in part, because it is impervious to major anti-fungal medications. 	1554766643244
The_Straits_Times:6DA1CC2C:130943:8	en:resin	The_Straits_Times:6DA1CC2C	B0053VMNYW	130943	This resin only hardens when exposed to light, which makes it easy for FasRaP to be applied to a structure. 	1554767415947
Nineteen_Eighty-Four:5EB7488E:43496:13	en:vernacular	Nineteen_Eighty-Four:5EB7488E	B0053VMNYW	43496	What was ‘disgusting rubbish’ back in a more insulated time has become, by the post-war era, part of the vernacular of political education, and by 1984 in Oceania it will be institutionalized. 	1554802778646
Nineteen_Eighty-Four:5EB7488E:45057:9	en:debase	Nineteen_Eighty-Four:5EB7488E	B0053VMNYW	45057	It has become a commonplace circa 2003 for government employees to be paid more than most of the rest of us to debase history, trivialize truth and annihilate the past on a daily basis. 	1554802861807
Nineteen_Eighty-Four:5EB7488E:50442:12	en:anterooms	Nineteen_Eighty-Four:5EB7488E	B0053VMNYW	50442	By the time they have left the Ministry of Love, Winston and Julia have entered permanently the condition of doublethink, the anterooms of annihilation, no longer in love but able to hate and love Big Brother at the same time. 	1554803113096
Nineteen_Eighty-Four:5EB7488E:53438:11	en:dystopia	Nineteen_Eighty-Four:5EB7488E	B0053VMNYW	53438	In its hints of restoration and redemption, perhaps ‘The Principles of Newspeak’ serves as a way to brighten an otherwise bleakly pessimistic ending – sending us back out into the streets of our own dystopia whistling a slightly happier tune than the end of the story by itself would have warranted. 	1554803240922
Nineteen_Eighty-Four:5EB7488E:58375:11	en:varicose	Nineteen_Eighty-Four:5EB7488E	B0053VMNYW	58375	The flat was seven flights up, and Winston, who was thirty-nine and had a varicose ulcer above his right ankle, went slowly, resting several times on the way. 	1554803434418
Nineteen_Eighty-Four:5EB7488E:58599:12	en:contrived	Nineteen_Eighty-Four:5EB7488E	B0053VMNYW	58599	It was one of those pictures which are so contrived that the eyes follow you about when you move. 	1554803458219
Nineteen_Eighty-Four:5EB7488E:60438:13	en:bluebottle	Nineteen_Eighty-Four:5EB7488E	B0053VMNYW	60438	In the far distance a helicopter skimmed down between the roofs, hovered for an instant like a bluebottle, and darted away again with a curving flight. 	1554803628591
