id	word_key	book_key	dict_key	pos	usage	timestamp
CR!GHMRXGCKBS40F9SBSKH8NMD5H562:AZYJAADmAAAA:541723:14	en:disquieting	CR!GHMRXGCKBS40F9SBSKH8NMD5H562	B0053VMNYW	AZYJAADmAAAA:541723	The news from the African front was disquieting in the extreme. 	1558620496448
CR!GHMRXGCKBS40F9SBSKH8NMD5H562:AZcJAABSAgAA:542904:15	en:inextricably	CR!GHMRXGCKBS40F9SBSKH8NMD5H562	B0053VMNYW	AZcJAABSAgAA:542904	The cloves and saccharine, themselves disgusting enough in their sickly way, could not disguise the flat oily smell; and what was worst of all was that the smell of gin, which dwelt with him night and day, was inextricably mixed up in his mind with the smell of those— He never named them, even in his thoughts, and so far as it was possible he never visualized them. 	1558620607605
CR!GHMRXGCKBS40F9SBSKH8NMD5H562:AZgJAAALBQAA:544253:11	en:sinecure	CR!GHMRXGCKBS40F9SBSKH8NMD5H562	B0053VMNYW	AZgJAAALBQAA:544253	He even had a job, a sinecure, more highly-paid than his old job had been. 	1558620698866
CR!GHMRXGCKBS40F9SBSKH8NMD5H562:AaAJAAC4AQAA:547761:11	en:crocuses	CR!GHMRXGCKBS40F9SBSKH8NMD5H562	B0053VMNYW	AaAJAAC4AQAA:547761	It was in the Park, on a vile, biting day in March, when the earth was like iron and all the grass seemed dead and there was not a bud anywhere except a few crocuses which had pushed themselves up to be dismembered by the wind. 	1558620916425
CR!GHMRXGCKBS40F9SBSKH8NMD5H562:AbMJAAAYAwAA:554048:13	en:admonished	CR!GHMRXGCKBS40F9SBSKH8NMD5H562	B0053VMNYW	AbMJAAAYAwAA:554048	No one cared what he did any longer, no whistle woke him, no telescreen admonished him. 	1558621218696
CR!GHMRXGCKBS40F9SBSKH8NMD5H562:AbMJAACqBwAA:555218:11	en:abstruse	CR!GHMRXGCKBS40F9SBSKH8NMD5H562	B0053VMNYW	AbMJAACqBwAA:555218	But there were other days when they settled down to their work almost eagerly, making a tremendous show of entering up their minutes and drafting long memoranda which were never finished—when the argument as to what they were supposedly arguing about grew extraordinarily involved and abstruse, with subtle haggling over definitions, enormous digressions, quarrels—threats, even, to appeal to higher authority. 	1558621282207
CR!GHMRXGCKBS40F9SBSKH8NMD5H562:AbcJAAAsAgAA:556961:14	en:wainscoting	CR!GHMRXGCKBS40F9SBSKH8NMD5H562	B0053VMNYW	AbcJAAAsAgAA:556961	Winston whined and grizzled, made futile demands for food, fretted about the room pulling everything out of place and kicking the wainscoting until the neighbours banged on the wall, while the younger child wailed intermittently. 	1558621418587
CR!GHMRXGCKBS40F9SBSKH8NMD5H562:AbcJAABAAwAA:557237:15	en:sporadically	CR!GHMRXGCKBS40F9SBSKH8NMD5H562	B0053VMNYW	AbcJAABAAwAA:557237	A lovely toy—you’ll love it”; and then she had gone out in the rain, to a little general shop which was still sporadically open nearby, and came back with a cardboard box containing an outfit of Snakes and Ladders. 	1558621443379
CR!GHMRXGCKBS40F9SBSKH8NMD5H562:AbcJAAAwBQAA:557733:14	en:tiddlywinks	CR!GHMRXGCKBS40F9SBSKH8NMD5H562	B0053VMNYW	AbcJAAAwBQAA:557733	Soon he was wildly excited and shouting with laughter as the tiddlywinks climbed hopefully up the ladders and then came slithering down the snakes again, almost to the starting-point. 	1558621474314
CR!GHMRXGCKBS40F9SBSKH8NMD5H562:AbsJAAAJAQAA:559880:11	en:bestrode	CR!GHMRXGCKBS40F9SBSKH8NMD5H562	B0053VMNYW	AbsJAAAJAQAA:559880	The colossus that bestrode the world! 	1558621579629
The_Straits_Times:01C87DC4:88079:11	en:redolent	The_Straits_Times:01C87DC4	B0053VMNYW	88079	US policy quixotic, says China envoy China's disarmament ambassador Li Song was responding to US calls for other nuclear powers to accept shared standards on nuclear weapons transparency.PHOTO: AFP Published 1 hour ago GENEVA • China said at the world's main disarmament forum that US foreign policy was destabilising, baffling and redolent of Don Quixote, the Spanish fictional hero whose misplaced determination leads him on a series of doomed endeavours. 	1558654914098
The_Straits_Times:01C87DC4:116744:9	en:litany	The_Straits_Times:01C87DC4	B0053VMNYW	116744	"Unleashing a familiar litany of gripes about special counsel Robert Mueller's Russia probe and the follow-up congressional inquiries that he has been stonewalling, Mr Trump also complained that Democrats had met to discuss whether to impeach him - or, as he called it, ""the I-word"". "	1558655237538
The_Straits_Times:01C87DC4:163533:8	en:silty	The_Straits_Times:01C87DC4	B0053VMNYW	163533	Two building contractors fined over silty water discharge Published 1 hour ago Two contractors have been fined for silty water discharge and inadequate earth control measures. 	1558655340139
The_Straits_Times:9A28BCB3:98969:13	en:inimitable	The_Straits_Times:9A28BCB3	B0053VMNYW	98969	Add to that Everest's inimitable appeal to a growing body of thrill-seekers the world over. 	1559000651770
The_Straits_Times:98952A63:13950:8	en:caste	The_Straits_Times:98952A63	B0053VMNYW	13950	5 Worries over caste incident The death of a young doctor from a backward tribal community at a Mumbai medical college has reignited concerns of caste-based harassment at Indian educational institutions and the lack of measures to address the problem. 	1559173810587
The_Straits_Times:98952A63:15980:19	en:unconstitutional	The_Straits_Times:98952A63	B0053VMNYW	15980	9 Huawei appeals to US courts Chinese technology giant Huawei has called on US courts to declare legislation that bars United States government agencies from using its equipment as unconstitutional. 	1559173877110
The_Straits_Times:7D4B35C0:126825:16	en:vertiginously	The_Straits_Times:7D4B35C0	B0053VMNYW	126825	PHOTO: AGENCE FRANCE-PRESSE Published 2 hours ago GRAND CANYON NATIONAL PARK • Attention, Grand Canyon visitors - watch your step before attempting a selfie from the edge of the vertiginously deep and perilously steep American landmark. 	1559519628738
The_Straits_Times:29A768B8:28744:6	en:But	The_Straits_Times:29A768B8	B0053VMNYW	28744	But within four days of consuming it, she developed palpitations, insomnia and subsequently suicidal thoughts. 	1559605679917
The_Straits_Times:29A768B8:28796:15	en:palpitations	The_Straits_Times:29A768B8	B0053VMNYW	28796	But within four days of consuming it, she developed palpitations, insomnia and subsequently suicidal thoughts. 	1559605683330
The_Straits_Times:29A768B8:72508:9	en:averse	The_Straits_Times:29A768B8	B0053VMNYW	72508	A China that's averse to political reforms - for now Published:  1 hour ago Thirty years ago, in the early hours of June 4, the world watched in shock and horror as tanks rolled into Beijing's main Tiananmen Square and West Chang'an Avenue and fired on student protesters calling for democracy and freedom. 	1559605864737
The_Straits_Times:C02DF2B0:97183:8	en:Sudan	The_Straits_Times:C02DF2B0	B0053VMNYW	97183	AGENCE FRANCE-PRESSE Sudan's military ruler offers to resume talks KHARTOUM • Sudan's military ruler, General Abdel Fattah Burhan, yesterday said he was open to talks on the country's future, a day after calling them off amid a crackdown on protesters. 	1559864460566
The_Straits_Times:08A2DF7A:13214:7	en:glut	The_Straits_Times:08A2DF7A	B0053VMNYW	13214	The aim is to avoid a supply glut amid a slowdown in the property market and a souring business outlook. 	1559865058655
The_Straits_Times:C8DC860C:65123:8	en:nexus	The_Straits_Times:C8DC860C	B0053VMNYW	65123	"The WSJ's source said there was a ""nexus"" between Mr Kim Jong Nam and the CIA, but many details of the link were unclear. "	1560298839579
The_Straits_Times:298AED41:97397:10	en:nomadic	The_Straits_Times:298AED41	B0053VMNYW	97397	The heavily armed assailants snatched the group of nomadic sea gypsies in the early hours as they sailed in two boats in the waters off eastern Sabah state, in the Malaysian part of Borneo. 	1560904394574
The_Straits_Times:298AED41:97409:10	en:gypsies	The_Straits_Times:298AED41	B0053VMNYW	97409	The heavily armed assailants snatched the group of nomadic sea gypsies in the early hours as they sailed in two boats in the waters off eastern Sabah state, in the Malaysian part of Borneo. 	1560904402863
The_Straits_Times:24B32B03:196525:18	en:surreptitiously	The_Straits_Times:24B32B03	B0053VMNYW	196525	Nurse jailed for filming colleagues in unisex bathroom Published 2 hours ago A nurse was sentenced to 12 weeks in jail yesterday for surreptitiously taking videos and photographs of his female colleagues as they used a unisex bathroom at their hospital. 	1561593557464
The_Straits_Times:AF128B6D:37442:16	en:gesticulating	The_Straits_Times:AF128B6D	B0053VMNYW	37442	"Chinese Foreign Ministry spokesman Geng Shuang said yesterday that Britain's rights and obligations under the joint declaration on the city had ended.PHOTO: REUTERS Published 1 hour ago BEIJING • China's Foreign Ministry said yesterday that Britain no longer has any responsibility for Hong Kong and needs to stop ""gesticulating"" about its former colony, after the British government reiterated its commitment to the joint declaration with China on the city. "	1562024180136
The_Straits_Times:95A56F01:146160:11	en:stowaway	The_Straits_Times:95A56F01	B0053VMNYW	146160	REUTERS Suspected stowaway falls to death from plane LONDON • The body of a suspected stowaway fell hundreds of metres from a plane flying over south-west London, landing in the garden of a man's home, just missing him as he sunbathed, neighbours said. 	1562110931555
The_Straits_Times:4F7BFDD0:111346:14	en:tantalising	The_Straits_Times:4F7BFDD0	B0053VMNYW	111346	Limits to what can be gained from China-bound investment The US-China trade war is turning into a big economic headache amid shrinking exports and as Chinese consumers dial back spending.PHOTO: AFP Published 1 hour ago Neighbours unable to muscle in as firms there are unlikely to exit It was supposed to represent a tantalising opportunity for the region's economies to muscle in on foreign investment bound for China. 	1562197426407
The_Straits_Times:4F7BFDD0:180779:10	en:awnings	The_Straits_Times:4F7BFDD0	B0053VMNYW	180779	Condo awnings a reasonable response to killer litter: Board The owners of two units at D'Leedon, a condominium complex in the prime Tanglin district, had sought permission last year to install awnings at their ground-floor units, in response to a killer litter problem.ST PHOTO: DESMOND FOO Published 1 hour ago Strata Titles Board takes issue with D'Leedon MC for initial refusal of unit owners' request The Strata Titles Board has taken issue with the management corporation (MC) of D'Leedon after the MC initially refused to allow the owners	1562197600831
The_Straits_Times:4DA480C9:12696:11	en:anathema	The_Straits_Times:4DA480C9	B0053VMNYW	12696	5 Inside the Uighur camps Western media reports vilify Uighur re-education centres as concentration camps, but it is hard to fault China for wanting to rehabilitate the Uighurs if their ideology is anathema to the Chinese state and hostile to other communities, says associate editor Ravi Velloor after a visit to these centres. 	1562284683619
The_Straits_Times:4DA480C9:194590:9	en:jockey	The_Straits_Times:4DA480C9	B0053VMNYW	194590	Court orders US$620,900 to be returned to ex-jockey Former jockey Saimee Jumaat had invested in a forex trading service in 2012, on the advice of two financial advisers. 	1562285648240
The_Straits_Times:F2596608:6234:13	en:seamstress	The_Straits_Times:F2596608	B0053VMNYW	6234	"Many protesters, like seamstress Celia Cheung, 66, said they attended the march yesterday because they felt it was important to lend support to a movement that seems to be losing momentum: ""We need to keep pressing on until the government responds."" "	1562542200251
The_Straits_Times:F2596608:108834:12	en:described	The_Straits_Times:F2596608	B0053VMNYW	108834	"In others, the newspaper said the envoy had described the administration as ""uniquely dysfunctional"" and that media reports about White House ""knife fights"" are ""mostly true"". "	1562542748877
The_Straits_Times:F2596608:108876:16	en:dysfunctional	The_Straits_Times:F2596608	B0053VMNYW	108876	"In others, the newspaper said the envoy had described the administration as ""uniquely dysfunctional"" and that media reports about White House ""knife fights"" are ""mostly true"". "	1562542752145
The_Straits_Times:F2596608:109735:14	en:unvarnished	The_Straits_Times:F2596608	B0053VMNYW	109735	"The Mail on Sunday cited a spokesman as saying that the public would expect diplomats ""to provide ministers with an honest, unvarnished assessment of the politics in their countries"". "	1562542794424
The_Straits_Times:F2596608:111058:11	en:brouhaha	The_Straits_Times:F2596608	B0053VMNYW	111058	REUTERS Brazil's President repeatedly defends child labour Published 1 hour ago RIO DE JANEIRO • Brazilian President Jair Bolsonaro, no stranger to controversy, sparked a new brouhaha last week by repeatedly defending the practice of child labour. 	1562542889791
The_Straits_Times:F2596608:111949:14	en:demagoguery	The_Straits_Times:F2596608	B0053VMNYW	111949	"This is not demagoguery, it is the truth."" "	1562542928892
The_Straits_Times:8C933233:37141:7	en:crux	The_Straits_Times:8C933233	B0053VMNYW	37141	"The crux of Japan's position is that South Korea has, since 2004, benefited from favourable trade measures as a ""trusted"" country, and the ""restrictions"" are in effect a return to the norm. "	1562802083200
The_Straits_Times:E282E53B:26903:13	en:consorting	The_Straits_Times:E282E53B	B0053VMNYW	26903	Tan Hong Sheng, 22, Loo Boon Chong, 25, and Chan Jia Xing, 26, had their charges reclassified to consorting with a person carrying an offensive weapon in a public place. 	1562888801148
The_Straits_Times:8E30FEFB:12626:6	en:But	The_Straits_Times:8E30FEFB	B0053VMNYW	12626	But none of the women showed any sign of being cowed by the President. 	1563233540007
The_Straits_Times:8E30FEFB:12673:8	en:cowed	The_Straits_Times:8E30FEFB	B0053VMNYW	12673	But none of the women showed any sign of being cowed by the President. 	1563233543656
The_Straits_Times:7FD70808:40404:18	en:surreptitiously	The_Straits_Times:7FD70808	B0053VMNYW	40404	"Rei Kurohi Prudential sues ex-agency leader for up to $2.5b over mass exodus of agents Prudential accuses former agency leader Peter Tan Shou Yi of ""surreptitiously"" orchestrating the mass defection of agents in 2016. "	1563319799525
The_Straits_Times:F3AD87E9:107648:10	en:phalanx	The_Straits_Times:F3AD87E9	B0053VMNYW	107648	Sometimes a phalanx of bodyguards jogs beside them. 	1563409758550
The_Straits_Times:045CA435:13127:9	en:cachet	The_Straits_Times:045CA435	B0053VMNYW	13127	Singapore Airlines has always had the global cachet to merit a second hub, and the partnership with India's Vistara may well give it that opportunity, says associate editor Ravi Velloor. 	1563493139118
The_Straits_Times:045CA435:55022:8	en:fluke	The_Straits_Times:045CA435	B0053VMNYW	55022	"girl dies after dad's golf ball strikes her head Aria Hill was sitting in a golf cart at the course where her father was teeing off when the accident happened.PHOTO: GOFUNDME/ ARIA HILL MEMORIAL FUND Published 1 hour ago SALT LAKE CITY (Utah) • A six-year-old girl in Utah died on Monday after she was struck in the head by a golf ball hit by her father, in what her uncle described as a ""fluke accident"". "	1563493448321
CR!J65NBWJ6TD2ZN86ZTF816ECKGJWP:AXwEAAB/AAAA:7480:14	en:subjugation	CR!J65NBWJ6TD2ZN86ZTF816ECKGJWP	B0053VMNYW	AXwEAAB/AAAA:7480	The subjugation of one race by another, the domination of women throughout thousands of years of patriarchy, and the devaluing of people based on social class are for growing numbers of us nightmares of the past. 	1563553196135
CR!J65NBWJ6TD2ZN86ZTF816ECKGJWP:AYoEAAAAAAAA:11479:12	en:EVOCATION	CR!J65NBWJ6TD2ZN86ZTF816ECKGJWP	B0053VMNYW	AYoEAAAAAAAA:11479	That is the arising of the new earth. —Eckhart Tolle October 2015 CHAPTER ONE The Flowering of Human Consciousness EVOCATION Earth, 114 million years ago, one morning just after sunrise: The first flower ever to appear on the planet opens up to receive the rays of the sun. 	1563553452694
CR!J65NBWJ6TD2ZN86ZTF816ECKGJWP:AZAEAAAZAgAA:13715:11	en:ethereal	CR!J65NBWJ6TD2ZN86ZTF816ECKGJWP	B0053VMNYW	AZAEAAAZAgAA:13715	Flowers, more fleeting, more ethereal, and more delicate than the plants out of which they emerged, would become like messengers from another realm, like a bridge between the world of physical forms and the formless. 	1563553580142
CR!J65NBWJ6TD2ZN86ZTF816ECKGJWP:AZQEAAALAAAA:15196:13	en:immemorial	CR!J65NBWJ6TD2ZN86ZTF816ECKGJWP	B0053VMNYW	AZQEAAALAAAA:15196	Since time immemorial, flowers, crystals, precious stones, and birds have held special significance for the human spirit. 	1563553650599
CR!J65NBWJ6TD2ZN86ZTF816ECKGJWP:AZ4EAACEAAAA:20774:14	en:recognition	CR!J65NBWJ6TD2ZN86ZTF816ECKGJWP	B0053VMNYW	AZ4EAACEAAAA:20774	An essential part of the awakening is the recognition of the unawakened you, the ego as it thinks, speaks, and acts, as well as the recognition of the collectively conditioned mental processes that perpetuate the unawakened state. 	1563553949863
CR!J65NBWJ6TD2ZN86ZTF816ECKGJWP:AZ4EAADGAAAA:20840:13	en:perpetuate	CR!J65NBWJ6TD2ZN86ZTF816ECKGJWP	B0053VMNYW	AZ4EAADGAAAA:20840	An essential part of the awakening is the recognition of the unawakened you, the ego as it thinks, speaks, and acts, as well as the recognition of the collectively conditioned mental processes that perpetuate the unawakened state. 	1563553953432
CR!J65NBWJ6TD2ZN86ZTF816ECKGJWP:AaAEAAC4AgAA:22393:8	en:sages	CR!J65NBWJ6TD2ZN86ZTF816ECKGJWP	B0053VMNYW	AaAEAAC4AgAA:22393	Ramana Maharshi, one of the greatest Indian sages, bluntly states: “The mind is maya.” 	1563554061475
CR!J65NBWJ6TD2ZN86ZTF816ECKGJWP:AaQEAABLAwAA:25083:9	en:maimed	CR!J65NBWJ6TD2ZN86ZTF816ECKGJWP	B0053VMNYW	AaQEAABLAwAA:25083	When the war was over in 1918, the survivors looked in horror and incomprehension upon the devastation left behind: ten million human beings killed and many more maimed or disfigured. 	1563703915268
CR!J65NBWJ6TD2ZN86ZTF816ECKGJWP:Aa4EAAD+AAAA:30565:17	en:contemporaries	CR!J65NBWJ6TD2ZN86ZTF816ECKGJWP	B0053VMNYW	Aa4EAAD+AAAA:30565	Those rare individuals then spoke to their contemporaries. 	1563704283344
CR!J65NBWJ6TD2ZN86ZTF816ECKGJWP:AbIEAADKAQAA:33615:15	en:iconoclastic	CR!J65NBWJ6TD2ZN86ZTF816ECKGJWP	B0053VMNYW	AbIEAADKAQAA:33615	Most of these schools were iconoclastic. 	1563704522252
CR!J65NBWJ6TD2ZN86ZTF816ECKGJWP:AbYEAAAMAQAA:36686:8	en:dogma	CR!J65NBWJ6TD2ZN86ZTF816ECKGJWP	B0053VMNYW	AbYEAAAMAQAA:36686	Partly as a result of the spiritual teachings that have arisen outside the established religions, but also due to an influx of the ancient Eastern wisdom teachings, a growing number of followers of traditional religions are able to let go of identification with form, dogma, and rigid belief systems and discover the original depth that is hidden within their own spiritual tradition at the same time as they discover the depth within themselves. 	1563704801681
CR!J65NBWJ6TD2ZN86ZTF816ECKGJWP:AbgEAAAxAAAA:37865:11	en:ossified	CR!J65NBWJ6TD2ZN86ZTF816ECKGJWP	B0053VMNYW	AbgEAAAxAAAA:37865	But the ego is destined to dissolve, and all its ossified structures, whether they be religious or other institutions, corporations, or governments, will disintegrate from within, no matter how deeply entrenched they appear to be. 	1563704888832
CR!J65NBWJ6TD2ZN86ZTF816ECKGJWP:AbgEAAALAQAA:38083:13	en:impervious	CR!J65NBWJ6TD2ZN86ZTF816ECKGJWP	B0053VMNYW	AbgEAAALAQAA:38083	The most rigid structures, the most impervious to change, will collapse first. 	1563704922721
CR!J65NBWJ6TD2ZN86ZTF816ECKGJWP:AboEAADFAAAA:38630:17	en:insurmountable	CR!J65NBWJ6TD2ZN86ZTF816ECKGJWP	B0053VMNYW	AboEAADFAAAA:38630	THE URGENCY OF TRANSFORMATION When faced with a radical crisis, when the old way of being in the world, of interacting with each other and with the realm of nature doesn’t work anymore, when survival is threatened by seemingly insurmountable problems, an individual life-form—or a species—will either die or become extinct or rise above the limitations of its condition through an evolutionary leap. 	1563704987617
CR!8Z0GKCQ5TS4PVC853MMFTVCSJG9Q:AYMEAAA1AAAA:50698:12	en:incessant	CR!8Z0GKCQ5TS4PVC853MMFTVCSJG9Q	B0053VMNYW	AYMEAAA1AAAA:50698	Most people are still completely identified with the incessant stream of mind, of compulsive thinking, most of it repetitive and pointless. 	1563721127232
CR!8Z0GKCQ5TS4PVC853MMFTVCSJG9Q:Aa0EAADRAAAA:75139:10	en:bulimia	CR!8Z0GKCQ5TS4PVC853MMFTVCSJG9Q	B0053VMNYW	Aa0EAADRAAAA:75139	The sufferers of bulimia will often make themselves vomit so they can continue eating. 	1563722754587
The_Straits_Times:68CDE083:103191:9	en:sleuth	The_Straits_Times:68CDE083	B0053VMNYW	103191	Concert in the Gardens Music, the food of love Unravelling the Dark Web: Hacks into hitman sites led to arrest of Singaporean ST ILLUSTRATION: MANNY FRANCISCO Published 1 hour ago Murder plot uncovered by London-based cyber sleuth who exposed Dark Web scams They exist in the shadowy online world to cater to clients' vengeful desires. 	1563752093277
CR!8Z0GKCQ5TS4PVC853MMFTVCSJG9Q:AdoEAAD5AAAA:100662:9	en:psyche	CR!8Z0GKCQ5TS4PVC853MMFTVCSJG9Q	B0053VMNYW	AdoEAAD5AAAA:100662	Collective grievances can survive for centuries in the psyche of a nation or tribe and fuel a never-ending cycle of violence. 	1563881904992
CR!8Z0GKCQ5TS4PVC853MMFTVCSJG9Q:AekEAACCAAAA:107545:10	en:Marxist	CR!8Z0GKCQ5TS4PVC853MMFTVCSJG9Q	B0053VMNYW	AekEAACCAAAA:107545	To him, the Marxist interpretation of history was the absolute truth, and according to his version of it, those who wore glasses belonged to the educated class, the bourgeoisie, the exploiters of the peasants. 	1563882380950
CR!8Z0GKCQ5TS4PVC853MMFTVCSJG9Q:AekEAAAbAQAA:107698:14	en:bourgeoisie	CR!8Z0GKCQ5TS4PVC853MMFTVCSJG9Q	B0053VMNYW	AekEAAAbAQAA:107698	To him, the Marxist interpretation of history was the absolute truth, and according to his version of it, those who wore glasses belonged to the educated class, the bourgeoisie, the exploiters of the peasants. 	1563887164840
CR!8Z0GKCQ5TS4PVC853MMFTVCSJG9Q:AfQEAACkBAAA:115878:13	en:Homeopathy	CR!8Z0GKCQ5TS4PVC853MMFTVCSJG9Q	B0053VMNYW	AfQEAACkBAAA:115878	Homeopathy and Chinese medicine are two examples of possible alternative approaches to disease that do not treat the illness as an enemy and therefore do not create new diseases. 	1563887728078
CR!8Z0GKCQ5TS4PVC853MMFTVCSJG9Q:ASEFAACtAgAA:138734:13	en:conformist	CR!8Z0GKCQ5TS4PVC853MMFTVCSJG9Q	B0053VMNYW	ASEFAACtAgAA:138734	Whereas in the 1950s, most Americans were still extremely conformist in thought and behavior, in the 1960s, millions of people began to withdraw their identification with a collective conceptual identity because the insanity of the collective was so obvious. 	1563889364106
CR!8Z0GKCQ5TS4PVC853MMFTVCSJG9Q:ASYFAAAmAAAA:141415:12	en:officiate	CR!8Z0GKCQ5TS4PVC853MMFTVCSJG9Q	B0053VMNYW	ASYFAAAmAAAA:141415	THE MONK WITH SWEATY PALMS Kasan, a Zen teacher and monk, was to officiate at a funeral of a famous nobleman. 	1563889509802
CR!8Z0GKCQ5TS4PVC853MMFTVCSJG9Q:AS0FAAB7AAAA:144228:10	en:elusive	CR!8Z0GKCQ5TS4PVC853MMFTVCSJG9Q	B0053VMNYW	AS0FAAB7AAAA:144228	Happiness is ever elusive, but freedom from unhappiness is attainable now, by facing what is rather than making up stories about it. 	1563889679156
The_Straits_Times:BB9F3886:34449:10	en:premier	The_Straits_Times:BB9F3886	B0053VMNYW	34449	PHOTO: REUTERS Published 1 hour ago Leader known for declaring martial law prior to Tiananmen crackdown in 1989 Former Chinese premier Li Peng, who declared martial law on national television days before the 1989 Tiananmen crackdown, died just before midnight on Monday of unspecified illness, state media announced yesterday. 	1563924436893
The_Straits_Times:3835FFE7:49021:8	en:great	The_Straits_Times:3835FFE7	B0053VMNYW	49021	"In his keynote address, he said Hong Kong still has a ""great future"" because it is useful to China. "	1564011030057
The_Straits_Times:3835FFE7:49080:10	en:proviso	The_Straits_Times:3835FFE7	B0053VMNYW	49080	But with the proviso that neither Hong Kong nor Macau tries to change mainland China, he added. 	1564011033382
The_Straits_Times:3835FFE7:167108:19	en:prophylactically	The_Straits_Times:3835FFE7	B0053VMNYW	167108	"Taking this prophylactically, it can prevent you from getting infected,"" said Dr Mike Robertson, director of global clinical development for virology at MSD research. "	1564011344246
The_Straits_Times:F0445148:44747:14	en:angioplasty	The_Straits_Times:F0445148	B0053VMNYW	44747	ESM Goh back in office after undergoing angioplasty Emeritus Senior Minister Goh Chok Tong said in a Facebook post he was back in the office after undergoing an angioplasty procedure on Tuesday, and apologised for having to cancel some events.PHOTO: ST FILE Published 1 hour ago Emeritus Senior Minister Goh Chok Tong on Tuesday underwent an angioplasty to restore blood flow in his arteries. 	1564097957331
The_Straits_Times:F0445148:141874:12	en:prostatic	The_Straits_Times:F0445148	B0053VMNYW	141874	"Published 1 hour ago CNB officers not told of prostatic massages because of 'uncertainty' over gay sex law: Ler The doctor involved in the HIV registry data leak told a court yesterday that he was ""afraid of being penalised"" under Section 377A of the Penal Code for providing prostatic massages, and decided against telling narcotics officers about it. "	1564098428461
CR!8Z0GKCQ5TS4PVC853MMFTVCSJG9Q:AWkFAAAOAgAA:175419:10	en:edifice	CR!8Z0GKCQ5TS4PVC853MMFTVCSJG9Q	B0053VMNYW	AWkFAAAOAgAA:175419	Most of what they tell you about themselves, their story, is a complete fantasy, a fictitious edifice the ego has designed for itself to feel bigger, more special. 	1564240070015
